Fecha valor,Fecha de operación,Importe,Moneda,Concepto,Entidad,Nombre de producto,Tipo de producto,Tipo de movimiento,Categoría,Nota
1/05/22,1/05/22,"0,21",EUR,Intereses a su favor,Ing Direct,Cuenta NARANJA,Cuenta,Ingreso,Rendimientos,
1/05/22,1/05/22,"0,02",EUR,Intereses a su favor,Ing Direct,Imprevistos,Cuenta,Ingreso,Rendimientos,
30/04/22,30/04/22,"-30,00",EUR,Transferencia bizum emitida,Ing Direct,Cuenta NÓMINA Principal,Cuenta,Gasto,Estudios,Clases lucia plazad
30/04/22,,"-154,94",EUR,Pago en avda union europea,Ing Direct,Tarjeta Crédito,Tarjeta de crédito,Gasto,Supermercado,Autorizacion
29/04/22,29/04/22,"-723,12",EUR,Recibo wizink bank s.a.u.,Ing Direct,Cuenta NÓMINA Principal,Cuenta,No computable,Tarjeta crédito,Pago mensual tarjeta 5267xxxxxxxx3740 liquidacion al dia : 27.04.2022
29/04/22,,"723,12",EUR,Pago recibo mes anterior,Wizink,WiZink Oro,Tarjeta de crédito,No computable,Tarjeta crédito,
28/04/22,28/04/22,"256,42",EUR,Nomina recibida h. principe de asturias,Ing Direct,Cuenta NÓMINA Cotitular Claudia - Compra Casa,Cuenta,Ingreso,Nómina,Paga: actual mas atrasos
28/04/22,28/04/22,"-34.954,90",EUR,Traspaso emitido cuenta nómina,Ing Direct,Cuenta NARANJA,Cuenta,No computable,Traspasos y transferencias,Movimiento cuenta nómina
28/04/22,28/04/22,"-28.000,00",EUR,Transferencia emitida a javier hernando plazas becerra escruturacion casa,Ing Direct,Cuenta NÓMINA Principal,Cuenta,No computable,Traspasos y transferencias,Escruturacion casa
28/04/22,28/04/22,"34.954,90",EUR,Traspaso recibido cuenta nómina,Ing Direct,Cuenta NÓMINA Principal,Cuenta,No computable,Traspasos y transferencias,Movimiento cuenta nómina
28/04/22,,"-35,00",EUR,Pago en manuel lafuente,Ing Direct,Tarjeta Crédito,Tarjeta de crédito,Gasto,Estudios,Autorizacion
28/04/22,,"-15,44",EUR,Pago en avda union europea,Ing Direct,Tarjeta Claudia,Tarjeta de crédito,Gasto,Supermercado,Autorizacion
28/04/22,28/04/22,"28.000,00",EUR,Transf. javier hernando plazas be,Kutxabank,cuenta ahorro,Cuenta,No computable,Traspasos y transferencias,
28/04/22,,"-50,00",EUR,Estacion servicio meco,Wizink,WiZink Oro,Tarjeta de crédito,Gasto,Gasolina,
27/04/22,27/04/22,"100,00",EUR,Transferencia recibida de a.e.a.t. devoluciones tributarias aeat apl:abono antic dedu familiares-fng22mod:143inf:familia numerosa gen 03-2022 exp:2022dev14329420096f aeat,Ing Direct,Cuenta NÓMINA Principal,Cuenta,Ingreso,Devolución impuestos,Aeat apl:abono antic dedu familiares-fng22mod:143inf:familia numerosa gen 03-2022 exp:2022dev14329420096f aeat
27/04/22,,"-86,38",EUR,Pago en mi casa alcala,Ing Direct,Tarjeta Claudia,Tarjeta de crédito,Gasto,Hogar,Autorizacion
27/04/22,,"-12,19",EUR,Pago en mercadona ensanche,Ing Direct,Tarjeta Claudia,Tarjeta de crédito,Gasto,Supermercado,Autorizacion
27/04/22,,"-57,43",EUR,Pago en estacion servicio meco,Ing Direct,Tarjeta Claudia,Tarjeta de crédito,Gasto,Gasolina,Autorizacion
27/04/22,,"-9,99",EUR,Spotifyes p1b209289b,Wizink,WiZink Oro,Tarjeta de crédito,Gasto,Servicios y productos online,
27/04/22,,"-35,00",EUR,Plan pro 2022,Wizink,WiZink Oro,Tarjeta de crédito,Gasto,Asesores y abogados,
27/04/22,,"-35,00",EUR,Plan pro 2022,Wizink,WiZink Oro,Tarjeta de crédito,Gasto,Asesores y abogados,
26/04/22,,"-24,08",EUR,Cafeteria vips beatriz,Wizink,WiZink Oro,Tarjeta de crédito,Gasto,Restaurante,
26/04/22,,"-3,65",EUR,Velazquez juan bravo,Wizink,WiZink Oro,Tarjeta de crédito,Gasto,Parking y peaje,
25/04/22,,"-4,00",EUR,Pago en farmacia carrefour alcala,Ing Direct,Tarjeta Claudia,Tarjeta de crédito,Gasto,Farmacia,Autorizacion
25/04/22,,"-350,00",EUR,Ceramicos brihuega,Wizink,WiZink Oro,Tarjeta de crédito,Gasto,Hogar,
25/04/22,,"-42,60",EUR,Amzn mktp es*2p2oe2pr4,Wizink,WiZink Oro,Tarjeta de crédito,Gasto,Otras compras,
24/04/22,,"-17,26",EUR,Pago en fcia. garcia alonso,Ing Direct,Tarjeta Claudia,Tarjeta de crédito,Gasto,Farmacia,Autorizacion
23/04/22,23/04/22,"4.169,38",EUR,"Nomina recibida audatex datos espana,sa",Ing Direct,Cuenta NÓMINA Principal,Cuenta,Ingreso,Nómina,Nomina/pid/04/a81246753000
23/04/22,,"-165,00",EUR,O'bogavante,Wizink,WiZink Oro,Tarjeta de crédito,Gasto,Restaurante,
23/04/22,,"-135,29",EUR,Avda union europea,Wizink,WiZink Oro,Tarjeta de crédito,Gasto,Supermercado,
22/04/22,,"-19,72",EUR,Pago en fcia. garcia alonso,Ing Direct,Tarjeta Claudia,Tarjeta de crédito,Gasto,Farmacia,Autorizacion
22/04/22,,"-7,07",EUR,Lidl alcala la dehesa,Wizink,WiZink Oro,Tarjeta de crédito,Gasto,Supermercado,
22/04/22,,"-303,00",EUR,Luz alcala,Wizink,WiZink Oro,Tarjeta de crédito,Gasto,Hogar,Lamparas
22/04/22,,"-9,08",EUR,Leroy merlin alcala,Wizink,WiZink Oro,Tarjeta de crédito,Gasto,Hogar,
21/04/22,,"-20,00",EUR,Pago en crc caracense,Ing Direct,Tarjeta Crédito,Tarjeta de crédito,Gasto,Ayuntamiento,Autorizacion
21/04/22,,"-71,98",EUR,Pago en mi casa alcala,Ing Direct,Tarjeta Claudia,Tarjeta de crédito,Gasto,Hogar,Autorizacion
21/04/22,,"-90,00",EUR,Pago en erikamedica,Ing Direct,Tarjeta Claudia,Tarjeta de crédito,Gasto,Médico,Autorizacion
20/04/22,,"-139,05",EUR,Pago en eurovia alcala,Ing Direct,Tarjeta Crédito,Tarjeta de crédito,Gasto,Estudios,Autorizacion
20/04/22,,"-3,75",EUR,Pago en fcia. garcia alonso,Ing Direct,Tarjeta Claudia,Tarjeta de crédito,Gasto,Farmacia,Autorizacion
20/04/22,,"-10,91",EUR,Colegio de registradores,Wizink,WiZink Oro,Tarjeta de crédito,Gasto,Ayuntamiento,
19/04/22,19/04/22,"-61,09",EUR,Recibo vodafone,Ing Direct,Cuenta NÓMINA Principal,Cuenta,Gasto,Internet,Factura: yi22-005768684/
19/04/22,19/04/22,"-125,00",EUR,Transferencia emitida periódica,Ing Direct,Cuenta NÓMINA Principal,Cuenta,No computable,Traspasos y transferencias,Transferencia universidad
19/04/22,19/04/22,"-474,22",EUR,Recibo tasacion servatas,Kutxabank,cuenta ahorro,Cuenta,Gasto,Otros vivienda,
19/04/22,19/04/22,"-125,00",EUR,Transferencia emitida a javier hernando plazas becerra tasación casa,Ing Direct,Cuenta NÓMINA Cotitular Claudia - Compra Casa,Cuenta,No computable,Traspasos y transferencias,Tasación casa
19/04/22,,"-5,20",EUR,Pago en p.segado. alpedrete,Ing Direct,Tarjeta Claudia,Tarjeta de crédito,Gasto,Restaurante,Autorizacion
19/04/22,19/04/22,"125,00",EUR,Transf. javier hernando plazas be,Kutxabank,cuenta ahorro,Cuenta,No computable,Traspasos y transferencias,
18/04/22,,"-56,38",EUR,Pago en estacion servicio meco,Ing Direct,Tarjeta Claudia,Tarjeta de crédito,Gasto,Gasolina,Autorizacion
18/04/22,,"48,00",EUR,Abono en gofer hogar sl.,Ing Direct,Tarjeta Claudia,Tarjeta de crédito,Gasto,Hogar,Autorizacion
18/04/22,,"-20,00",EUR,Erikamedica,Wizink,WiZink Oro,Tarjeta de crédito,Gasto,Médico,
17/04/22,,"-1,90",EUR,Atpseitt m-50n->meco,Wizink,WiZink Oro,Tarjeta de crédito,Gasto,Parking y peaje,
16/04/22,,"-44,41",EUR,Pago en e3056 alcala henares - c/,Ing Direct,Tarjeta Crédito,Tarjeta de crédito,Gasto,Gasolina,Autorizacion
16/04/22,,"-54,99",EUR,Pago en sprinter alcala de henare,Ing Direct,Tarjeta Claudia,Tarjeta de crédito,Gasto,Material deportivo,Autorizacion
16/04/22,,"-42,39",EUR,Pago en mi casa alcala,Ing Direct,Tarjeta Claudia,Tarjeta de crédito,Gasto,Hogar,Autorizacion
16/04/22,,"-71,82",EUR,Avda union europea,Wizink,WiZink Oro,Tarjeta de crédito,Gasto,Supermercado,
16/04/22,,"1,33",EUR,Abono por campaña abono shopping naranja:galp,Ing Direct,Tarjeta Crédito,Tarjeta de crédito,Gasto,Gasolina,Operacion
13/04/22,,"-59,50",EUR,Pago en ikea la gavia hfb,Ing Direct,Tarjeta Crédito,Tarjeta de crédito,Gasto,Hogar,Autorizacion
13/04/22,,"-2,70",EUR,Pago en avda union europea,Ing Direct,Tarjeta Crédito,Tarjeta de crédito,Gasto,Supermercado,Autorizacion
13/04/22,,"3,95",EUR,Abono en avda union europea,Ing Direct,Tarjeta Crédito,Tarjeta de crédito,Gasto,Supermercado,Autorizacion
13/04/22,,"-32,82",EUR,Pago en avda union europea,Ing Direct,Tarjeta Crédito,Tarjeta de crédito,Gasto,Supermercado,Autorizacion
12/04/22,12/04/22,"-85,28",EUR,Univ.de alcala,ImaginBank,Antes cta .....2594,Cuenta,Gasto,Estudios,Alcalaaca0114059
12/04/22,,"-5,40",EUR,Pago en carnicas molinero,Ing Direct,Tarjeta Claudia,Tarjeta de crédito,Gasto,Supermercado,Autorizacion
12/04/22,,"-48,00",EUR,Pago en gofer hogar sl.,Ing Direct,Tarjeta Claudia,Tarjeta de crédito,Gasto,Hogar,Autorizacion
11/04/22,11/04/22,"-242,87",EUR,"Recibo volkswagen bank, gmbh s.e.",Ing Direct,Cuenta NÓMINA Principal,Cuenta,Gasto,Compra vehículo,"Vcto. 09/04/2022, contrato: 01fi50031252,atencion cliente volkswagen bank : 914279900,el pago de este recibo no implica pagos anteriores."
11/04/22,,"-11,99",EUR,Pago en hpi instant ink spain,Ing Direct,Tarjeta Crédito,Tarjeta de crédito,Gasto,Electrónica,Autorizacion
11/04/22,,"-28,99",EUR,Pago en tramas mas la dehesa alcala de hen,Ing Direct,Tarjeta Claudia,Tarjeta de crédito,Gasto,Hogar,Operacion
9/04/22,9/04/22,"-90,00",EUR,Reintegro efectivo tarjeta la caixa 4045 meco es,Ing Direct,Cuenta NÓMINA Principal,Cuenta,Gasto,Efectivo,La caixa 4045 meco es
9/04/22,,"-103,75",EUR,Pago en avda union europea meco,Ing Direct,Tarjeta Crédito,Tarjeta de crédito,Gasto,Supermercado,Operacion
9/04/22,,"-41,67",EUR,Pago en women s secret torrejon de a,Ing Direct,Tarjeta Claudia,Tarjeta de crédito,Gasto,Ropa,Operacion
9/04/22,,"-13,98",EUR,Pago en tramas la dehesa alcala de hen,Ing Direct,Tarjeta Claudia,Tarjeta de crédito,Gasto,Hogar,Operacion
8/04/22,,"-1,90",EUR,Pago en atpseitt m 50n >meco madrid,Ing Direct,Tarjeta Crédito,Tarjeta de crédito,Gasto,Parking y peaje,Operacion
8/04/22,,"-0,60",EUR,Pago en atpseitt aeropuert >aero madrid,Ing Direct,Tarjeta Claudia,Tarjeta de crédito,Gasto,Parking y peaje,Operacion
8/04/22,,"-0,60",EUR,Pago en atpseitt alcobenda >alco madrid,Ing Direct,Tarjeta Claudia,Tarjeta de crédito,Gasto,Parking y peaje,Operacion
8/04/22,,"-1,90",EUR,Pago en atpseitt meco >m 50n madrid,Ing Direct,Tarjeta Claudia,Tarjeta de crédito,Gasto,Parking y peaje,Operacion
7/04/22,7/04/22,"-1.146,66",EUR,Amortización total de préstamo,Ing Direct,Cuenta NÓMINA Principal,Cuenta,Gasto,Préstamos,Amortización préstamo
7/04/22,7/04/22,"-7.746,41",EUR,Amortización total de préstamo,Ing Direct,Cuenta NÓMINA Principal,Cuenta,Gasto,Préstamos,Amortización préstamo
7/04/22,7/04/22,"26.000,00",EUR,Abono de préstamo,Ing Direct,Cuenta NÓMINA Principal,Cuenta,Ingreso,Ingreso efectivo,Prestamo ing unificación de créditos 
7/04/22,,"-47,48",EUR,Pago en costco wholesale spain s,Ing Direct,Tarjeta Crédito,Tarjeta de crédito,Gasto,Gasolina,Autorizacion
7/04/22,,"-50,00",EUR,Pago en erikamedica,Ing Direct,Tarjeta Claudia,Tarjeta de crédito,Gasto,Médico,Autorizacion
7/04/22,,"-36,87",EUR,Pago en avda union europea,Ing Direct,Tarjeta Claudia,Tarjeta de crédito,Gasto,Supermercado,Autorizacion
7/04/22,,"-1,90",EUR,Pago en atpseitt m 50n >meco madrid,Ing Direct,Tarjeta Crédito,Tarjeta de crédito,Gasto,Parking y peaje,Operacion
6/04/22,6/04/22,"-400,00",EUR,Traspaso periódico emitido nómina,Ing Direct,Cuenta NÓMINA Principal,Cuenta,No computable,Traspasos y transferencias,Spo to 2700287602
6/04/22,6/04/22,"400,00",EUR,Traspaso periódico recibido,Ing Direct,Imprevistos,Cuenta,No computable,Traspasos y transferencias,Spo from 1708097649
6/04/22,,"-10,82",EUR,Pago en fcia. garcia alonso,Ing Direct,Tarjeta Claudia,Tarjeta de crédito,Gasto,Farmacia,Autorizacion
5/04/22,5/04/22,"-730,53",EUR,Cargo mensual tarjeta crédito,Ing Direct,Cuenta NÓMINA Principal,Cuenta,No computable,Tarjeta crédito,Liq. tarjeta crédito : 0160001
4/04/22,4/04/22,"-350,00",EUR,Recibo fundacion colegio alborada,Ing Direct,Cuenta NÓMINA Principal,Cuenta,Gasto,Estudios,Cobro procedente de la factura 92344
4/04/22,4/04/22,"-23,14",EUR,Recibo endesa x servicios s.l.,Ing Direct,Cuenta NÓMINA Principal,Cuenta,Gasto,Electricidad,P-34319562
4/04/22,4/04/22,"-34,33",EUR,"Recibo banco cooperativo espanol, s.a.",Ing Direct,Cuenta NÓMINA Principal,Cuenta,Gasto,Óptica y dentista,Recibo de pr stamo 2038754855 periodo: 01-03-2022 al 01-04-2022.para mayor informaci n consulte a la entidad emisora del recibo.
4/04/22,4/04/22,"-25,00",EUR,Transferencia emitida a sandra martin natalia plazas abril 2022,Ing Direct,Cuenta NÓMINA Principal,Cuenta,Gasto,Deporte,Natalia plazas abril 2022
4/04/22,4/04/22,"-96,00",EUR,Transferencia bizum emitida,Ing Direct,Cuenta NÓMINA Principal,Cuenta,Gasto,Estudios,Clases luly marzo 2022
4/04/22,,"-34,94",EUR,Pago en decathlon alcala,Ing Direct,Tarjeta Claudia,Tarjeta de crédito,Gasto,Material deportivo,Autorizacion
3/04/22,3/04/22,"-136,44",EUR,Cargo cuota de préstamo,Ing Direct,Cuenta NÓMINA Principal,Cuenta,Gasto,Préstamos,Cargo cuota préstamo 7715027306/21
3/04/22,3/04/22,"-90,23",EUR,Cargo cuota de préstamo,Ing Direct,Cuenta NÓMINA Principal,Cuenta,Gasto,Préstamos,Cargo cuota préstamo 7712284698/35
2/04/22,2/04/22,"8,00",EUR,Transferencia bizum recibida,Ing Direct,Cuenta NÓMINA Principal,Cuenta,Ingreso,Transferencias,Sin concepto
2/04/22,2/04/22,"-90,00",EUR,Reintegro efectivo tarjeta la caixa 4045 meco es,Ing Direct,Cuenta NÓMINA Principal,Cuenta,Gasto,Efectivo,La caixa 4045 meco es
2/04/22,,"-110,04",EUR,Avda union europea,Ing Direct,Tarjeta Crédito,Tarjeta de crédito,Gasto,Supermercado,Autorizacion
1/04/22,1/04/22,"-10,00",EUR,Adeudo recibo parroquia ntra. sra. del transito,Sabadell,CUENTA EXPANSIÓN,Cuenta,Gasto,Solidaridad,022901 039031473060000 01 p eur 02320139031473060000bsch057651722801000******0000
1/04/22,1/04/22,"0,24",EUR,Intereses a su favor,Ing Direct,Cuenta NARANJA,Cuenta,Ingreso,Rendimientos,
1/04/22,1/04/22,"0,02",EUR,Intereses a su favor,Ing Direct,Imprevistos,Cuenta,Ingreso,Rendimientos,
1/04/22,1/04/22,"-17,05",EUR,Recibo digi spain telecom sl,Ing Direct,Cuenta NÓMINA Principal,Cuenta,Gasto,Móvil,Factura digi
1/04/22,1/04/22,"-26,25",EUR,Recibo adeslas madrid,Ing Direct,Cuenta NÓMINA Principal,Cuenta,Gasto,Seguro salud,"Adeslas dental fam val:01.04.22-30.04.22 pneta:26,21 mes. clea:0,04 ips:0,00 copagos:0,00 poliza:282145990/0"
1/04/22,1/04/22,"-13,24",EUR,Recibo metlife europe designated activitycompany,Ing Direct,Cuenta NÓMINA Principal,Cuenta,Gasto,Seguro vida,002021732******4251p:2203014569 p.net 12.20 con 0.04 clea 0.02 ips 0.98 mes vto 010422 politica privacidad www.metlife.es 900201040
1/04/22,,"-1,90",EUR,Pago en atpseitt m 50n >meco madrid,Ing Direct,Tarjeta Crédito,Tarjeta de crédito,Gasto,Parking y peaje,Operacion
31/03/22,31/03/22,"1.894,70",EUR,Nomina recibida h. principe de asturias,Ing Direct,Cuenta NÓMINA Cotitular Claudia - Compra Casa,Cuenta,Ingreso,Nómina,Paga: actual mas atrasos
31/03/22,31/03/22,"-635,79",EUR,Recibo wizink bank s.a.u.,Ing Direct,Cuenta NÓMINA Principal,Cuenta,No computable,Tarjeta crédito,Pago mensual tarjeta 5267xxxxxxxx3740 liquidacion al dia : 29.03.2022
31/03/22,31/03/22,"350,00",EUR,Transf. javier hernando plazas be,Kutxabank,cuenta ahorro,Cuenta,No computable,Traspasos y transferencias,
31/03/22,,"635,79",EUR,Pago recibo mes anterior,Wizink,WiZink Oro,Tarjeta de crédito,No computable,Tarjeta crédito,
31/03/22,31/03/22,"-20,00",EUR,Ingreso fondos-planes,Ing Direct,Cuenta NÓMINA Principal,Cuenta,Ingreso,Otros ingresos,Aportaciones al plan: 4103616046-15-20
31/03/22,31/03/22,"-350,00",EUR,Transferencia emitida a javier hernando plazas becerra provisión tasacion kutxabank,Ing Direct,Cuenta NÓMINA Principal,Cuenta,No computable,Traspasos y transferencias,Provisión tasacion kutxabank
31/03/22,,"-35,00",EUR,Pago en manuel lafuente,Ing Direct,Tarjeta Crédito,Tarjeta de crédito,Gasto,Estudios,Autorizacion
31/03/22,,"-120,00",EUR,Pago en erikamedica,Ing Direct,Tarjeta Claudia,Tarjeta de crédito,Gasto,Médico,Autorizacion
31/03/22,,"-36,00",EUR,Amazon prime*298e14pr4,Wizink,WiZink Oro,Tarjeta de crédito,Gasto,Otras compras,
29/03/22,29/03/22,"-5,58",EUR,Transferencia bizum emitida,Ing Direct,Cuenta NÓMINA Principal,Cuenta,Gasto,Transferencias,Claudia buendia
29/03/22,,"-62,52",EUR,Pago en estacion servicio meco alameda,Ing Direct,Tarjeta Claudia,Tarjeta de crédito,Gasto,Gasolina,Operacion
29/03/22,,"-3,64",EUR,Pago en registro de la propiedad meco,Ing Direct,Tarjeta Claudia,Tarjeta de crédito,Gasto,Comunidad,Operacion
29/03/22,,"-15,90",EUR,Pago en tintoreria urbanclean meco,Ing Direct,Tarjeta Claudia,Tarjeta de crédito,Gasto,Restaurante,Operacion
29/03/22,,"-16,80",EUR,Pago en las cuatro reglas meco,Ing Direct,Tarjeta Claudia,Tarjeta de crédito,Gasto,Restaurante,Operacion
28/03/22,28/03/22,"-300,00",EUR,Transferencia emitida a maría garcia ramos regalo a los novios claudia y javier,Ing Direct,Cuenta NÓMINA Principal,Cuenta,Gasto,Regalos,Regalo a los novios claudia y javier
28/03/22,,"-23,37",EUR,Pago en fcia. garcia alonso,Ing Direct,Tarjeta Claudia,Tarjeta de crédito,Gasto,Farmacia,Autorizacion
27/03/22,,"-25,47",EUR,"Costco wholesale spain, s",Wizink,WiZink Oro,Tarjeta de crédito,Gasto,Restaurante,
27/03/22,,"-181,97",EUR,"Costco wholesale spain, s",Wizink,WiZink Oro,Tarjeta de crédito,Gasto,Supermercado,
27/03/22,,"-100,00",EUR,Costco gasolinera getafe,Wizink,WiZink Oro,Tarjeta de crédito,Gasto,Gasolina,
27/03/22,,"-11,95",EUR,Costco gasolinera getafe,Wizink,WiZink Oro,Tarjeta de crédito,Gasto,Gasolina,
27/03/22,,"-6,90",EUR,Fusion cafe y panaderia,Wizink,WiZink Oro,Tarjeta de crédito,Gasto,Restaurante,
27/03/22,,"-9,99",EUR,Spotifyes p1a900232d,Wizink,WiZink Oro,Tarjeta de crédito,Gasto,Otras compras,
26/03/22,26/03/22,"100,00",EUR,Transferencia recibida de a.e.a.t. devoluciones tributarias aeat apl:abono antic dedu familiares-fng22mod:143inf:familia numerosa gen 02-2022 exp:2022dev14329420052m aeat,Ing Direct,Cuenta NÓMINA Principal,Cuenta,Ingreso,Devolución impuestos,Aeat apl:abono antic dedu familiares-fng22mod:143inf:familia numerosa gen 02-2022 exp:2022dev14329420052m aeat
26/03/22,,"-34,00",EUR,Viena estilistas,Ing Direct,Tarjeta Claudia,Tarjeta de crédito,Gasto,Belleza,Autorizacion
26/03/22,,"-30,21",EUR,Avda union europea,Wizink,WiZink Oro,Tarjeta de crédito,Gasto,Supermercado,
26/03/22,,"-0,95",EUR,Seitt-r3r5tronco vicalvar,Wizink,WiZink Oro,Tarjeta de crédito,Gasto,Parking y peaje,
25/03/22,,"-9,70",EUR,Pasteleria riquelme,Wizink,WiZink Oro,Tarjeta de crédito,Gasto,Restaurante,
25/03/22,,"-153,00",EUR,Camapolis,Wizink,WiZink Oro,Tarjeta de crédito,Gasto,Hogar,
24/03/22,24/03/22,"3.811,38",EUR,"Nomina recibida audatex datos espana, s.a.",Ing Direct,Cuenta NÓMINA Principal,Cuenta,Ingreso,Nómina,
24/03/22,24/03/22,"-15,00",EUR,Intereses y/o comisiones,Sabadell,CUENTA EXPANSIÓN,Cuenta,Gasto,Cargos bancarios,
24/03/22,,"-36,73",EUR,Mercadona cc alcala magna,Ing Direct,Tarjeta Claudia,Tarjeta de crédito,Gasto,Supermercado,Autorizacion
23/03/22,,"-4,80",EUR,Copytema,Ing Direct,Tarjeta Claudia,Tarjeta de crédito,Gasto,Librería,Autorizacion
23/03/22,,"-2,60",EUR,Bombon boss alcala de h,Ing Direct,Tarjeta Claudia,Tarjeta de crédito,Gasto,Restaurante,Autorizacion
22/03/22,,"-22,19",EUR,Avda union europea,Ing Direct,Tarjeta Claudia,Tarjeta de crédito,Gasto,Supermercado,Autorizacion
21/03/22,21/03/22,"-59,99",EUR,Recibo vodafone,Ing Direct,Cuenta NÓMINA Principal,Cuenta,Gasto,Internet,Factura: yi22-004142482/
21/03/22,21/03/22,"-125,00",EUR,Transferencia emitida periódica,Ing Direct,Cuenta NÓMINA Principal,Cuenta,No computable,Traspasos y transferencias,Transferencia universidad
21/03/22,,"-5,20",EUR,Bombon boss alcala de h,Ing Direct,Tarjeta Claudia,Tarjeta de crédito,Gasto,Ropa,Autorizacion
21/03/22,21/03/22,"125,00",EUR,Transfer - transferencia universidad,ImaginBank,Antes cta .....2594,Cuenta,No computable,Traspasos y transferencias,Origen: 14650100
19/03/22,,"-1,11",EUR,Carref alcala,Wizink,WiZink Oro,Tarjeta de crédito,Gasto,Supermercado,
19/03/22,,"-18,90",EUR,Fcia. garcia alonso,Wizink,WiZink Oro,Tarjeta de crédito,Gasto,Farmacia,
19/03/22,,"-88,34",EUR,Avda union europea,Wizink,WiZink Oro,Tarjeta de crédito,Gasto,Supermercado,
19/03/22,,"-11,31",EUR,5088 lidl alcal\ de he,Wizink,WiZink Oro,Tarjeta de crédito,Gasto,Supermercado,
18/03/22,,"-5,00",EUR,Delikia,Ing Direct,Tarjeta Crédito,Tarjeta de crédito,Gasto,Restaurante,Autorizacion
18/03/22,,"-12,57",EUR,Avda union europea,Ing Direct,Tarjeta Claudia,Tarjeta de crédito,Gasto,Supermercado,Autorizacion
18/03/22,,"-35,42",EUR,Grupo ahorramas 1371,Wizink,WiZink Oro,Tarjeta de crédito,Gasto,Supermercado,
18/03/22,,"-1,90",EUR,Atpseitt m-50n->meco,Wizink,WiZink Oro,Tarjeta de crédito,Gasto,Parking y peaje,
17/03/22,,"-6,50",EUR,E3056 alcala henares - c/,Ing Direct,Tarjeta Crédito,Tarjeta de crédito,Gasto,Mantenimiento vehículo,Autorizacion
17/03/22,,"-1,25",EUR,Fcia. garcia alonso,Ing Direct,Tarjeta Claudia,Tarjeta de crédito,Gasto,Farmacia,Autorizacion
17/03/22,,"0,20",EUR,Abono por campaña abono shopping naranja:galp,Ing Direct,Tarjeta Crédito,Tarjeta de crédito,Gasto,Gasolina,Operacion
16/03/22,16/03/22,"-51,50",EUR,Transferencia bizum emitida,Ing Direct,Cuenta NÓMINA Principal,Cuenta,Gasto,Hotel,San sebastian sofia
16/03/22,,"-23,75",EUR,Avda union europea,Ing Direct,Tarjeta Claudia,Tarjeta de crédito,Gasto,Supermercado,Autorizacion
16/03/22,15/03/22,"0,00",EUR,Liq. de int.hasta 15.03.22,Kutxabank,cuenta ahorro,Cuenta,Ingreso,Rendimientos,
15/03/22,,"-64,08",EUR,Estacion servicio meco,Ing Direct,Tarjeta Claudia,Tarjeta de crédito,Gasto,Gasolina,Autorizacion
12/03/22,,"-77,47",EUR,Avda union europea,Ing Direct,Tarjeta Crédito,Tarjeta de crédito,Gasto,Supermercado,Autorizacion
12/03/22,,"-11,99",EUR,Hpi instant ink spain www.hp.com,Ing Direct,Tarjeta Crédito,Tarjeta de crédito,Gasto,Servicios y productos online,Operacion
11/03/22,,"-5,45",EUR,Avda union europea,Ing Direct,Tarjeta Claudia,Tarjeta de crédito,Gasto,Supermercado,Autorizacion
11/03/22,,"-11,95",EUR,E.s. bp oyambre,Ing Direct,Tarjeta Claudia,Tarjeta de crédito,Gasto,Gasolina,Autorizacion
11/03/22,,"-1,90",EUR,Atpseitt m 50n >meco madrid,Ing Direct,Tarjeta Crédito,Tarjeta de crédito,Gasto,Parking y peaje,Operacion
10/03/22,,"-54,84",EUR,Avda union europea,Ing Direct,Tarjeta Crédito,Tarjeta de crédito,Gasto,Supermercado,Autorizacion
10/03/22,,"-95,75",EUR,Estacion servicio meco,Ing Direct,Tarjeta Crédito,Tarjeta de crédito,Gasto,Gasolina,Autorizacion
10/03/22,,"-11,12",EUR,Estilo pontejos s.l.,Ing Direct,Tarjeta Claudia,Tarjeta de crédito,Gasto,Belleza,Autorizacion
10/03/22,,"-9,95",EUR,Calzedonia alcala magna,Ing Direct,Tarjeta Claudia,Tarjeta de crédito,Gasto,Ropa,Autorizacion
10/03/22,,"-40,05",EUR,Zara alcala cc.alc.magna,Ing Direct,Tarjeta Claudia,Tarjeta de crédito,Gasto,Ropa,Autorizacion
9/03/22,9/03/22,"-242,87",EUR,"Recibo volkswagen bank, gmbh s.e.",Ing Direct,Cuenta NÓMINA Principal,Cuenta,Gasto,Compra vehículo,"Vcto. 09/03/2022, contrato: 01fi50031252,atencion cliente volkswagen bank : 914279900,el pago de este recibo no implica pagos anteriores."
8/03/22,,"-10,75",EUR,Pepeleria libreria cervan,Ing Direct,Tarjeta Claudia,Tarjeta de crédito,Gasto,Librería,Autorizacion
8/03/22,8/03/22,"-85,29",EUR,Univ.de alcala,ImaginBank,Antes cta .....2594,Cuenta,Gasto,Estudios,Alcalaaca0114059
7/03/22,7/03/22,"-35,80",EUR,Recibo ayuntamiento de meco,Ing Direct,Cuenta NÓMINA Principal,Cuenta,Gasto,Ayuntamiento,S.e.p. personas fisicas. plazo 1 de 5 de 2022 exp. 0000015394
7/03/22,,"-19,95",EUR,Farmacia carrefour alcala,Ing Direct,Tarjeta Claudia,Tarjeta de crédito,Gasto,Farmacia,Autorizacion
7/03/22,,"-76,55",EUR,Xoom,Wizink,WiZink Oro,Tarjeta de crédito,Gasto,Regalos,
7/03/22,,"-87,77",EUR,Xoom,Wizink,WiZink Oro,Tarjeta de crédito,Gasto,Regalos,
6/03/22,6/03/22,"-400,00",EUR,Traspaso periódico emitido nómina,Ing Direct,Cuenta NÓMINA Principal,Cuenta,No computable,Traspasos y transferencias,Spo to 2700287602
6/03/22,6/03/22,"400,00",EUR,Traspaso periódico recibido,Ing Direct,Imprevistos,Cuenta,No computable,Traspasos y transferencias,Spo from 1708097649
6/03/22,,"-45,00",EUR,Estacion servicio meco,Ing Direct,Tarjeta Claudia,Tarjeta de crédito,Gasto,Gasolina,Autorizacion
5/03/22,5/03/22,"-54,00",EUR,Transferencia bizum emitida,Ing Direct,Cuenta NÓMINA Principal,Cuenta,Gasto,Ropa,Lucia plazas y macarena gil
5/03/22,5/03/22,"-919,62",EUR,Cargo mensual tarjeta crédito,Ing Direct,Cuenta NÓMINA Principal,Cuenta,No computable,Tarjeta crédito,Liq. tarjeta crédito : 0160001
5/03/22,,"-53,68",EUR,Avda union europea,Ing Direct,Tarjeta Crédito,Tarjeta de crédito,Gasto,Supermercado,Autorizacion
5/03/22,,"-3,88",EUR,Mercadona espartales,Ing Direct,Tarjeta Claudia,Tarjeta de crédito,Gasto,Supermercado,Autorizacion
4/03/22,4/03/22,"-25,00",EUR,Transferencia emitida a sandra martin natalia plazas marzo 2022,Ing Direct,Cuenta NÓMINA Principal,Cuenta,Gasto,Deporte,Natalia plazas marzo 2022
4/03/22,4/03/22,"-350,00",EUR,Recibo fundacion colegio alborada,Ing Direct,Cuenta NÓMINA Principal,Cuenta,Gasto,Estudios,Cobro procedente de la factura 89052
4/03/22,,"-48,43",EUR,Avda union europea,Ing Direct,Tarjeta Crédito,Tarjeta de crédito,Gasto,Supermercado,Autorizacion
4/03/22,,"-8,00",EUR,Las cuatro reglas,Ing Direct,Tarjeta Crédito,Tarjeta de crédito,Gasto,Librería,Autorizacion
4/03/22,,"-1,90",EUR,Atpseitt m 50n >meco madrid,Ing Direct,Tarjeta Crédito,Tarjeta de crédito,Gasto,Parking y peaje,Operacion
3/03/22,3/03/22,"-136,44",EUR,Cargo cuota de préstamo,Ing Direct,Cuenta NÓMINA Principal,Cuenta,Gasto,Préstamos,Cargo cuota préstamo 7715027306/20
3/03/22,3/03/22,"-90,23",EUR,Cargo cuota de préstamo,Ing Direct,Cuenta NÓMINA Principal,Cuenta,Gasto,Préstamos,Cargo cuota préstamo 7712284698/34
3/03/22,3/03/22,"-72,00",EUR,Transferencia bizum emitida,Ing Direct,Cuenta NÓMINA Principal,Cuenta,Gasto,Estudios,Lucia febrero
2/03/22,2/03/22,"-34,33",EUR,"Recibo banco cooperativo espanol, s.a.",Ing Direct,Cuenta NÓMINA Principal,Cuenta,Gasto,Óptica y dentista,Recibo de pr stamo 2038754855 periodo: 01-02-2022 al 01-03-2022.para mayor informaci n consulte a la entidad emisora del recibo.
2/03/22,2/03/22,"100,00",EUR,Transferencia recibida de a.e.a.t. devoluciones tributarias aeat apl:abono antic dedu familiares-fng22mod:143inf:familia numerosa gen 01-2022 exp:2022dev14329420014l aeat,Ing Direct,Cuenta NÓMINA Principal,Cuenta,Ingreso,Devolución impuestos,Aeat apl:abono antic dedu familiares-fng22mod:143inf:familia numerosa gen 01-2022 exp:2022dev14329420014l aeat
2/03/22,2/03/22,"-26,25",EUR,Recibo adeslas madrid,Ing Direct,Cuenta NÓMINA Principal,Cuenta,Gasto,Seguro salud,"Adeslas dental fam val:01.03.22-31.03.22 pneta:26,21 mes. clea:0,04 ips:0,00 copagos:0,00 poliza:282145990/0"
1/03/22,1/03/22,"-10,00",EUR,Adeudo recibo parroquia ntra. sra. del transito,Sabadell,CUENTA EXPANSIÓN,Cuenta,Gasto,Solidaridad,022901 038112709100000 01 p eur 02320138112709100000bsch057651722801000******6000
1/03/22,1/03/22,"0,22",EUR,Intereses a su favor,Ing Direct,Cuenta NARANJA,Cuenta,Ingreso,Rendimientos,
1/03/22,1/03/22,"0,01",EUR,Intereses a su favor,Ing Direct,Imprevistos,Cuenta,Ingreso,Rendimientos,
1/03/22,1/03/22,"-12,03",EUR,Recibo digi spain telecom sl,Ing Direct,Cuenta NÓMINA Principal,Cuenta,Gasto,Móvil,Factura digi
1/03/22,1/03/22,"-5,13",EUR,Recibo telefonica moviles espana,Ing Direct,Cuenta NÓMINA Principal,Cuenta,Gasto,Móvil,Factura tuenti
1/03/22,1/03/22,"-13,24",EUR,Recibo metlife europe designated activitycompany,Ing Direct,Cuenta NÓMINA Principal,Cuenta,Gasto,Seguro vida,002021731******0869p:2203014569 p.net 12.20 con 0.04 clea 0.02 ips 0.98 mes vto 010322 politica privacidad www.metlife.es 900201040
1/03/22,,"-11,34",EUR,Shein.com,Wizink,WiZink Oro,Tarjeta de crédito,Gasto,Ropa,
28/02/22,28/02/22,"-619,04",EUR,Recibo wizink bank s.a.u.,Ing Direct,Cuenta NÓMINA Principal,Cuenta,No computable,Tarjeta crédito,Pago mensual tarjeta 5267xxxxxxxx3740 liquidacion al dia : 23.02.2022
28/02/22,28/02/22,"-260,00",EUR,Reintegro efectivo tarjeta la caixa 4045 meco es,Ing Direct,Cuenta NÓMINA Principal,Cuenta,Gasto,Otros vivienda,La caixa 4045 meco es
28/02/22,28/02/22,"-20,00",EUR,Ingreso fondos-planes,Ing Direct,Cuenta NÓMINA Principal,Cuenta,No computable,Inversiones,Aportaciones al plan: 4103616046-15-19
28/02/22,,"619,04",EUR,Pago recibo mes anterior,Wizink,WiZink Oro,Tarjeta de crédito,No computable,Tarjeta crédito,
28/02/22,,"-19,68",EUR,Avda union europea,Wizink,WiZink Oro,Tarjeta de crédito,Gasto,Supermercado,
27/02/22,,"-31,30",EUR,O bogavante,Wizink,WiZink Oro,Tarjeta de crédito,Gasto,Restaurante,
27/02/22,,"-0,50",EUR,Bkt-mad-park-o-ca,Wizink,WiZink Oro,Tarjeta de crédito,Gasto,Parking y peaje,
27/02/22,,"-9,99",EUR,Spotifyes p1a046a480,Wizink,WiZink Oro,Tarjeta de crédito,Gasto,Servicios y productos online,
26/02/22,26/02/22,"1.512,77",EUR,Nomina recibida h. principe de asturias,Ing Direct,Cuenta NÓMINA Cotitular Claudia - Compra Casa,Cuenta,Ingreso,Nómina,Paga: actual mas atrasos
26/02/22,,"-11,34",EUR,Carref alcala,Wizink,WiZink Oro,Tarjeta de crédito,Gasto,Supermercado,
26/02/22,,"-19,97",EUR,Carref alcala,Wizink,WiZink Oro,Tarjeta de crédito,Gasto,Supermercado,
26/02/22,,"-61,50",EUR,Avda union europea,Wizink,WiZink Oro,Tarjeta de crédito,Gasto,Supermercado,
25/02/22,,"-15,38",EUR,Romanza hayuelos,Ing Direct,Tarjeta Claudia,Tarjeta de crédito,Gasto,Ropa,Autorizacion
25/02/22,,"-15,04",EUR,Avda union europea,Wizink,WiZink Oro,Tarjeta de crédito,Gasto,Supermercado,
24/02/22,24/02/22,"3.811,38",EUR,"Nomina recibida audatex datos espana, s.a.",Ing Direct,Cuenta NÓMINA Principal,Cuenta,Ingreso,Nómina,
24/02/22,,"-35,00",EUR,Manuel lafuente,Ing Direct,Tarjeta Crédito,Tarjeta de crédito,Gasto,Estudios,Autorizacion
24/02/22,,"-46,16",EUR,Tania,Ing Direct,Tarjeta Claudia,Tarjeta de crédito,Gasto,Ropa,Autorizacion
23/02/22,,"-15,10",EUR,Yenny constanza gutier,Ing Direct,Tarjeta Claudia,Tarjeta de crédito,Gasto,Ropa,Autorizacion
23/02/22,,"-22,77",EUR,Artesanias lejo vega,Ing Direct,Tarjeta Claudia,Tarjeta de crédito,Gasto,Regalos,Autorizacion
22/02/22,22/02/22,"-11,57",EUR,Recibo endesa x servicios s.l.,Ing Direct,Cuenta NÓMINA Principal,Cuenta,Gasto,Electricidad,P-31426622
22/02/22,,"62,99",EUR,Xoom,Wizink,WiZink Oro,Tarjeta de crédito,Gasto,Transferencias,
22/02/22,,"-62,99",EUR,Xoom,Wizink,WiZink Oro,Tarjeta de crédito,Gasto,Transferencias,
22/02/22,,"-1,90",EUR,Atpseitt m-50n->meco,Wizink,WiZink Oro,Tarjeta de crédito,Gasto,Parking y peaje,
21/02/22,21/02/22,"-62,17",EUR,Recibo vodafone,Ing Direct,Cuenta NÓMINA Principal,Cuenta,Gasto,Internet,Factura: yi22-002491539/
21/02/22,21/02/22,"-125,00",EUR,Transferencia emitida periódica,Ing Direct,Cuenta NÓMINA Principal,Cuenta,No computable,Traspasos y transferencias,Transferencia universidad
21/02/22,21/02/22,"125,00",EUR,Transfer - transferencia universidad,ImaginBank,Antes cta .....2594,Cuenta,Gasto,Estudios,Origen: 14650100
20/02/22,,"-62,99",EUR,Xoom,Wizink,WiZink Oro,Tarjeta de crédito,Gasto,Transferencias,
19/02/22,,"-15,09",EUR,R05 crepesywaffles uni,Ing Direct,Tarjeta Claudia,Tarjeta de crédito,Gasto,Restaurante,Autorizacion
19/02/22,,"-163,31",EUR,Avda union europea,Wizink,WiZink Oro,Tarjeta de crédito,Gasto,Supermercado,
18/02/22,,"-54,41",EUR,Estacion servicio meco,Wizink,WiZink Oro,Tarjeta de crédito,Gasto,Gasolina,
18/02/22,,"-3,80",EUR,Bkt-mad-park-o-ca,Wizink,WiZink Oro,Tarjeta de crédito,Gasto,Parking y peaje,
18/02/22,,"-1,90",EUR,Atpseitt m-50n->meco,Wizink,WiZink Oro,Tarjeta de crédito,Gasto,Parking y peaje,
18/02/22,,"-1,90",EUR,Atpseitt meco->m-50n,Wizink,WiZink Oro,Tarjeta de crédito,Gasto,Parking y peaje,
18/02/22,,"-0,60",EUR,Atpseitt alcobenda->alco,Wizink,WiZink Oro,Tarjeta de crédito,Gasto,Parking y peaje,
16/02/22,16/02/22,"-82,42",EUR,"Recibo ocaso, s.a. seguros/reaseguros madrid",Ing Direct,Cuenta NÓMINA Principal,Cuenta,Gasto,Seguro vida,Inicio periodo 28/02/22 pago trim vida riesgo 10100 2428451 r923 info privacidad y proteccion de datos en www.ocaso.es/datos
16/02/22,16/02/22,"-82,42",EUR,"Recibo ocaso, s.a. seguros/reaseguros madrid",Ing Direct,Cuenta NÓMINA Principal,Cuenta,Gasto,Seguro vida,Inicio periodo 28/02/22 pago trim vida riesgo 10100 2428436 r922 info privacidad y proteccion de datos en www.ocaso.es/datos
16/02/22,,"-24,96",EUR,Lefties,Ing Direct,Tarjeta Claudia,Tarjeta de crédito,Gasto,Ropa,Autorizacion
16/02/22,,"-2,99",EUR,Sfera m alcala magna,Ing Direct,Tarjeta Claudia,Tarjeta de crédito,Gasto,Ropa,Autorizacion
16/02/22,,"-5,99",EUR,Zara alcala cc.alc.magna,Ing Direct,Tarjeta Claudia,Tarjeta de crédito,Gasto,Ropa,Autorizacion
16/02/22,,"-11,94",EUR,Fcia. garcia alonso,Ing Direct,Tarjeta Claudia,Tarjeta de crédito,Gasto,Farmacia,Autorizacion
16/02/22,16/02/22,"10,00",EUR,Ingreso en efectivo,BBVA,CUENTAS PERSONALES,Cuenta,Ingreso,Ingreso efectivo,Bbva oficina nº 6408
15/02/22,,"-74,24",EUR,Estacion servicio meco,Ing Direct,Tarjeta Crédito,Tarjeta de crédito,Gasto,Gasolina,Autorizacion
15/02/22,,"-19,55",EUR,Avda union europea,Ing Direct,Tarjeta Claudia,Tarjeta de crédito,Gasto,Supermercado,Autorizacion
14/02/22,,"-12,65",EUR,Avda union europea,Ing Direct,Tarjeta Claudia,Tarjeta de crédito,Gasto,Supermercado,Autorizacion
14/02/22,,"-8,30",EUR,Chinata alcala de henarer,Ing Direct,Tarjeta Claudia,Tarjeta de crédito,Gasto,Regalos,Autorizacion
13/02/22,13/02/22,"8,30",EUR,Transferencia bizum recibida,Ing Direct,Cuenta NÓMINA Principal,Cuenta,Ingreso,Transferencias,Devolucion fiesta maca
13/02/22,,"-10,40",EUR,Adriley alimentacion sl,Ing Direct,Tarjeta Claudia,Tarjeta de crédito,Gasto,Supermercado,Autorizacion
12/02/22,,"-28,97",EUR,Avda union europea meco,Ing Direct,Tarjeta Crédito,Tarjeta de crédito,Gasto,Supermercado,Operacion
11/02/22,,"-58,56",EUR,Avda union europea,Ing Direct,Tarjeta Crédito,Tarjeta de crédito,Gasto,Supermercado,Autorizacion
11/02/22,,"-11,99",EUR,Hpi instant ink spain,Ing Direct,Tarjeta Crédito,Tarjeta de crédito,Gasto,Servicios y productos online,Autorizacion
11/02/22,,"-5,75",EUR,Avda union europea,Ing Direct,Tarjeta Claudia,Tarjeta de crédito,Gasto,Supermercado,Autorizacion
10/02/22,,"-36,07",EUR,Oysho,Ing Direct,Tarjeta Claudia,Tarjeta de crédito,Gasto,Ropa,Autorizacion
9/02/22,9/02/22,"-10,00",EUR,Adeudo recibo parroquia ntra. sra. del transito,Sabadell,CUENTA EXPANSIÓN,Cuenta,Gasto,Solidaridad,022901 038093051850000 01 p eur 02320138093051850000bsch057651722801000******7000
9/02/22,9/02/22,"-242,87",EUR,"Recibo volkswagen bank, gmbh s.e.",Ing Direct,Cuenta NÓMINA Principal,Cuenta,Gasto,Compra vehículo,"Vcto. 09/02/2022, contrato: 01fi50031252,atencion cliente volkswagen bank : 914279900,el pago de este recibo no implica pagos anteriores."
9/02/22,9/02/22,"5,00",EUR,Transferencia bizum recibida,Ing Direct,Cuenta NÓMINA Principal,Cuenta,Ingreso,Transferencias,Gabriela regalo macarena
9/02/22,,"-21,82",EUR,Avda union europea,Ing Direct,Tarjeta Crédito,Tarjeta de crédito,Gasto,Supermercado,Autorizacion
9/02/22,,"-51,74",EUR,Estacion servicio meco,Ing Direct,Tarjeta Claudia,Tarjeta de crédito,Gasto,Gasolina,Autorizacion
9/02/22,,"-1,93",EUR,Comisión por cambio de divisa,Wizink,WiZink Oro,Tarjeta de crédito,Gasto,Cargos bancarios,
9/02/22,,"-96,67",EUR,Tlf*harrys famous flow,Wizink,WiZink Oro,Tarjeta de crédito,Gasto,Regalos,
7/02/22,7/02/22,"-85,29",EUR,Univ.de alcala,ImaginBank,Antes cta .....2594,Cuenta,Gasto,Estudios,Alcalaaca0114059
6/02/22,6/02/22,"-400,00",EUR,Traspaso periódico emitido nómina,Ing Direct,Cuenta NÓMINA Principal,Cuenta,No computable,Traspasos y transferencias,Spo to 2700287602
6/02/22,6/02/22,"400,00",EUR,Traspaso periódico recibido,Ing Direct,Imprevistos,Cuenta,No computable,Traspasos y transferencias,Spo from 1708097649
6/02/22,,"-8,47",EUR,Adriley alimentacion s,Ing Direct,Tarjeta Crédito,Tarjeta de crédito,Gasto,Supermercado,Autorizacion
5/02/22,5/02/22,"336,69",EUR,Transferencia recibida de grupo bc de asesoria hipotecaria s.l. 38600159,Ing Direct,Cuenta NÓMINA Cotitular Claudia - Compra Casa,Cuenta,Ingreso,Transferencias,38600159
5/02/22,5/02/22,"-1.621,86",EUR,Cargo mensual tarjeta crédito,Ing Direct,Cuenta NÓMINA Principal,Cuenta,No computable,Tarjeta crédito,Liq. tarjeta crédito : 0160001
5/02/22,,"-6,50",EUR,E3056 alcala henares - c/,Ing Direct,Tarjeta Crédito,Tarjeta de crédito,Gasto,Gasolina,Autorizacion
5/02/22,,"-135,76",EUR,Avda union europea,Ing Direct,Tarjeta Crédito,Tarjeta de crédito,Gasto,Supermercado,Autorizacion
5/02/22,,"0,20",EUR,Abono por campaña abono shopping naranja:galp,Ing Direct,Tarjeta Crédito,Tarjeta de crédito,Gasto,Gasolina,Operacion
4/02/22,,"-20,15",EUR,O bogavante,Ing Direct,Tarjeta Crédito,Tarjeta de crédito,Gasto,Restaurante,Autorizacion
4/02/22,,"-7,59",EUR,Avda union europea,Ing Direct,Tarjeta Crédito,Tarjeta de crédito,Gasto,Supermercado,Autorizacion
4/02/22,,"-7,63",EUR,Amazon.es*yr9kl66k5 am,Wizink,WiZink Oro,Tarjeta de crédito,Gasto,Electrónica,
3/02/22,3/02/22,"-136,44",EUR,Cargo cuota de préstamo,Ing Direct,Cuenta NÓMINA Principal,Cuenta,Gasto,Préstamos,Cargo cuota préstamo 7715027306/19
3/02/22,3/02/22,"-90,23",EUR,Cargo cuota de préstamo,Ing Direct,Cuenta NÓMINA Principal,Cuenta,Gasto,Préstamos,Cargo cuota préstamo 7712284698/33
3/02/22,3/02/22,"-60,00",EUR,Transferencia bizum emitida,Ing Direct,Cuenta NÓMINA Principal,Cuenta,Gasto,Estudios,Luly enero 2022
3/02/22,3/02/22,"-25,00",EUR,Transferencia emitida a sandra martin natalia plazas febrero 2022,Ing Direct,Cuenta NÓMINA Principal,Cuenta,Gasto,Deporte,Natalia plazas febrero 2022
3/02/22,,"-79,74",EUR,Estacion servicio meco,Ing Direct,Tarjeta Crédito,Tarjeta de crédito,Gasto,Gasolina,Autorizacion
2/02/22,2/02/22,"-26,25",EUR,Recibo adeslas madrid,Ing Direct,Cuenta NÓMINA Principal,Cuenta,Gasto,Seguro salud,"Adeslas dental fam val:01.02.22-28.02.22 pneta:26,21 mes. clea:0,04 ips:0,00 copagos:0,00 poliza:282145990/0"
2/02/22,2/02/22,"-34,33",EUR,"Recibo banco cooperativo espanol, s.a.",Ing Direct,Cuenta NÓMINA Principal,Cuenta,Gasto,Óptica y dentista,Recibo de pr stamo 2038754855 periodo: 01-01-2022 al 01-02-2022.para mayor informaci n consulte a la entidad emisora del recibo.
2/02/22,2/02/22,"-350,00",EUR,Recibo fundacion colegio alborada,Ing Direct,Cuenta NÓMINA Principal,Cuenta,Gasto,Estudios,Cobro procedente de la factura 86033
2/02/22,,"-44,36",EUR,Libreria abecedario,Ing Direct,Tarjeta Claudia,Tarjeta de crédito,Gasto,Librería,Autorizacion
2/02/22,,"-8,60",EUR,Mazuelas,Ing Direct,Tarjeta Claudia,Tarjeta de crédito,Gasto,Belleza,Autorizacion
2/02/22,,"-12,95",EUR,Calzedonia alcala magna,Ing Direct,Tarjeta Claudia,Tarjeta de crédito,Gasto,Ropa,Autorizacion
2/02/22,,"-1,00",EUR,Atpseitt alcala >meco madrid,Ing Direct,Tarjeta Crédito,Tarjeta de crédito,Gasto,Parking y peaje,Operacion
1/02/22,1/02/22,"0,24",EUR,Intereses a su favor,Ing Direct,Cuenta NARANJA,Cuenta,Ingreso,Rendimientos,
1/02/22,1/02/22,"0,01",EUR,Intereses a su favor,Ing Direct,Imprevistos,Cuenta,Ingreso,Rendimientos,
1/02/22,1/02/22,"-10,00",EUR,Recibo digi spain telecom sl,Ing Direct,Cuenta NÓMINA Principal,Cuenta,Gasto,Móvil,Factura digi
1/02/22,1/02/22,"-77,89",EUR,Recibo servicios financieros carrefour efc sa,Ing Direct,Cuenta NÓMINA Principal,Cuenta,Gasto,Electrónica,Financie-febrero
1/02/22,1/02/22,"-13,24",EUR,Recibo metlife europe designated activitycompany,Ing Direct,Cuenta NÓMINA Principal,Cuenta,Gasto,Seguro vida,002021730******8828p:2203014569 p.net 12.20 con 0.04 clea 0.02 ips 0.98 mes vto 010222 politica privacidad www.metlife.es 900201040
1/02/22,1/02/22,"-7,25",EUR,Recibo telefonica moviles espana,Ing Direct,Cuenta NÓMINA Principal,Cuenta,Gasto,Móvil,Factura tuenti
31/01/22,31/01/22,"-23,14",EUR,Recibo endesa x servicios s.l.,Ing Direct,Cuenta NÓMINA Principal,Cuenta,Gasto,Electricidad,P-29372617
31/01/22,31/01/22,"-387,31",EUR,Recibo wizink bank s.a.u.,Ing Direct,Cuenta NÓMINA Principal,Cuenta,No computable,Tarjeta crédito,Pago mensual tarjeta 5267xxxxxxxx3740 liquidacion al dia : 26.01.2022
31/01/22,31/01/22,"-20,00",EUR,Ingreso fondos-planes,Ing Direct,Cuenta NÓMINA Principal,Cuenta,No computable,Inversiones,Aportaciones al plan: 4103616046-15-18
31/01/22,,"38,00",EUR,Abono en t120 pilar prieto,Ing Direct,Tarjeta Claudia,Tarjeta de crédito,Gasto,Ropa,Autorizacion
31/01/22,,"-26,99",EUR,Ficty factory,Ing Direct,Tarjeta Claudia,Tarjeta de crédito,Gasto,Ropa,Autorizacion
31/01/22,,"-38,00",EUR,T120 pilar prieto,Ing Direct,Tarjeta Claudia,Tarjeta de crédito,Gasto,Ropa,Autorizacion
31/01/22,,"-20,14",EUR,Deichmann alcalà de,Ing Direct,Tarjeta Claudia,Tarjeta de crédito,Gasto,Ropa,Autorizacion
31/01/22,,"-12,15",EUR,Avda union europea,Ing Direct,Tarjeta Claudia,Tarjeta de crédito,Gasto,Supermercado,Autorizacion
31/01/22,,"387,31",EUR,Pago recibo mes anterior,Wizink,WiZink Oro,Tarjeta de crédito,No computable,Tarjeta crédito,
29/01/22,29/01/22,"1.510,40",EUR,Nomina recibida h. principe de asturias,Ing Direct,Cuenta NÓMINA Cotitular Claudia - Compra Casa,Cuenta,Ingreso,Nómina,Paga: actual mas atrasos
29/01/22,,"-32,50",EUR,O'bogavante,Wizink,WiZink Oro,Tarjeta de crédito,Gasto,Restaurante,
29/01/22,,"-88,24",EUR,Avda union europea,Wizink,WiZink Oro,Tarjeta de crédito,Gasto,Supermercado,
27/01/22,27/01/22,"-19,56",EUR,Transferencia bizum emitida,Ing Direct,Cuenta NÓMINA Principal,Cuenta,Gasto,Transferencias,Lucia plazas cumple maca
27/01/22,,"-47,22",EUR,Estacion servicio meco,Ing Direct,Tarjeta Claudia,Tarjeta de crédito,Gasto,Gasolina,Autorizacion
27/01/22,,"-9,99",EUR,Spotifyes p197fbad69,Wizink,WiZink Oro,Tarjeta de crédito,Gasto,Servicios y productos online,
26/01/22,,"-8,25",EUR,Avda union europea,Ing Direct,Tarjeta Crédito,Tarjeta de crédito,Gasto,Supermercado,Autorizacion
26/01/22,,"-7,66",EUR,Avda union europea,Ing Direct,Tarjeta Claudia,Tarjeta de crédito,Gasto,Supermercado,Autorizacion
25/01/22,25/01/22,"3.811,38",EUR,"Nomina recibida audatex datos espana, s.a.",Ing Direct,Cuenta NÓMINA Principal,Cuenta,Ingreso,Nómina,
25/01/22,,"-13,10",EUR,Chinata alcala de henarer,Ing Direct,Tarjeta Claudia,Tarjeta de crédito,Gasto,Hogar,Autorizacion
25/01/22,,"-72,99",EUR,Mariquita trasquila,Wizink,WiZink Oro,Tarjeta de crédito,Gasto,Ropa,
24/01/22,,"-12,76",EUR,Avda union europea,Ing Direct,Tarjeta Claudia,Tarjeta de crédito,Gasto,Supermercado,Autorizacion
23/01/22,,"-3,45",EUR,Bkt-mad-park-o-ca,Wizink,WiZink Oro,Tarjeta de crédito,Gasto,Parking y peaje,
22/01/22,22/01/22,"-30,00",EUR,Traspaso bizum emitido,Ing Direct,Cuenta NÓMINA Principal,Cuenta,Gasto,Transferencias,Claudia buendia
22/01/22,,"-11,73",EUR,Store asia s.l.,Wizink,WiZink Oro,Tarjeta de crédito,Gasto,Hogar,
22/01/22,,"-21,66",EUR,Carref alcala,Wizink,WiZink Oro,Tarjeta de crédito,Gasto,Supermercado,
22/01/22,,"-89,35",EUR,Avda union europea,Wizink,WiZink Oro,Tarjeta de crédito,Gasto,Supermercado,
22/01/22,,"69,59",EUR,Abono en xoom luxembourg,Ing Direct,Tarjeta Crédito,Tarjeta de crédito,Ingreso,Transferencias,Operacion
21/01/22,21/01/22,"100,00",EUR,Transferencia recibida de a.e.a.t. devoluciones tributarias aeat apl:abono antic dedu familiares-fng21mod:143inf:familia numerosa gen 12-2021 exp:2021dev14329420477m aeat,Ing Direct,Cuenta NÓMINA Principal,Cuenta,Ingreso,Devolución impuestos,Aeat apl:abono antic dedu familiares-fng21mod:143inf:familia numerosa gen 12-2021 exp:2021dev14329420477m aeat
19/01/22,19/01/22,"-59,99",EUR,Recibo vodafone,Ing Direct,Cuenta NÓMINA Principal,Cuenta,Gasto,Internet,Factura: yi22-000726302/
19/01/22,19/01/22,"-125,00",EUR,Transferencia emitida periódica,Ing Direct,Cuenta NÓMINA Principal,Cuenta,No computable,Traspasos y transferencias,Transferencia universidad
19/01/22,,"-14,20",EUR,Avda union europea meco,Ing Direct,Tarjeta Claudia,Tarjeta de crédito,Gasto,Supermercado,Operacion
19/01/22,,"-74,95",EUR,Estacion servicio meco,Wizink,WiZink Oro,Tarjeta de crédito,Gasto,Gasolina,
19/01/22,19/01/22,"125,00",EUR,Transfer - transferencia universidad,ImaginBank,Antes cta .....2594,Cuenta,Gasto,Estudios,Origen: 14650100
17/01/22,,"-5,64",EUR,Pago comunidad de madrid,Ing Direct,Tarjeta Crédito,Tarjeta de crédito,Gasto,Ayuntamiento,Autorizacion
16/01/22,,"-33,63",EUR,Pago en publix #442 altamonte spg,Ing Direct,Tarjeta Crédito,Tarjeta de crédito,Gasto,Supermercado,Operacion
16/01/22,,"-52,60",EUR,Pago en papa liu meco,Ing Direct,Tarjeta Crédito,Tarjeta de crédito,Gasto,Restaurante,Operacion
16/01/22,,"-49,02",EUR,Pago en zara alcala cc.alc.magna alcala de hen,Ing Direct,Tarjeta Claudia,Tarjeta de crédito,Gasto,Ropa,Operacion
16/01/22,,"-9,99",EUR,Dismoda com distrib,Wizink,WiZink Oro,Tarjeta de crédito,Gasto,Regalos,
16/01/22,,"-9,99",EUR,Dismoda com distrib,Wizink,WiZink Oro,Tarjeta de crédito,Gasto,Regalos,
16/01/22,,"-33,07",EUR,Zara alcala cc.alc.magna,Wizink,WiZink Oro,Tarjeta de crédito,Gasto,Regalos,
15/01/22,,"-93,66",EUR,Avda union europea,Ing Direct,Tarjeta Crédito,Tarjeta de crédito,Gasto,Supermercado,Autorizacion
14/01/22,,"-51,13",EUR,Estacion servicio meco,Ing Direct,Tarjeta Crédito,Tarjeta de crédito,Gasto,Gasolina,Autorizacion
14/01/22,,"-744,01",EUR,Avianca airlines gc,Ing Direct,Tarjeta Crédito,Tarjeta de crédito,Gasto,Transportes,Autorizacion
14/01/22,,"-54,90",EUR,Zalando payments,Wizink,WiZink Oro,Tarjeta de crédito,Gasto,Ropa,
13/01/22,,"-24,63",EUR,Avda union europea,Ing Direct,Tarjeta Crédito,Tarjeta de crédito,Gasto,Supermercado,Autorizacion
12/01/22,,"-11,99",EUR,Hpi instant ink spain,Ing Direct,Tarjeta Crédito,Tarjeta de crédito,Gasto,Servicios y productos online,Autorizacion
12/01/22,,"-7,85",EUR,Fcia. garcia alonso,Ing Direct,Tarjeta Claudia,Tarjeta de crédito,Gasto,Farmacia,Autorizacion
11/01/22,11/01/22,"-4.988,08",EUR,Traspaso interno emitido,Ing Direct,Cuenta NÓMINA Cotitular Claudia - Compra Casa,Cuenta,No computable,Traspasos y transferencias,Transferencia cuenta principal
11/01/22,11/01/22,"4.988,08",EUR,Traspaso interno recibido,Ing Direct,Cuenta NÓMINA Principal,Cuenta,No computable,Traspasos y transferencias,Transferencia cuenta principal
11/01/22,11/01/22,"-10,00",EUR,Transferencia bizum emitida,Ing Direct,Cuenta NÓMINA Principal,Cuenta,Gasto,Transferencias,Regalo david de la horra
11/01/22,,"-18,90",EUR,Fcia. garcia alonso,Ing Direct,Tarjeta Crédito,Tarjeta de crédito,Gasto,Farmacia,Autorizacion
11/01/22,,"-3,90",EUR,L0ka84 hospital ppe astur,Ing Direct,Tarjeta Claudia,Tarjeta de crédito,Gasto,Restaurante,Autorizacion
11/01/22,,"-13,20",EUR,Tintoreria urbanclean,Ing Direct,Tarjeta Claudia,Tarjeta de crédito,Gasto,Otros servicios,Autorizacion
11/01/22,,"-31,82",EUR,Avda union europea,Ing Direct,Tarjeta Claudia,Tarjeta de crédito,Gasto,Supermercado,Autorizacion
10/01/22,10/01/22,"-242,87",EUR,"Recibo volkswagen bank, gmbh s.e.",Ing Direct,Cuenta NÓMINA Principal,Cuenta,Gasto,Compra vehículo,"Vcto. 09/01/2022, contrato: 01fi50031252,atencion cliente volkswagen bank : 914279900,el pago de este recibo no implica pagos anteriores."
10/01/22,,"-2,60",EUR,Bombon boss alcala de h,Ing Direct,Tarjeta Claudia,Tarjeta de crédito,Gasto,Restaurante,Autorizacion
9/01/22,,"-116,72",EUR,Ghaocw.com,Ing Direct,Tarjeta Crédito,Tarjeta de crédito,Gasto,Hogar,Autorizacion
7/01/22,,"-61,26",EUR,Avda union europea meco,Ing Direct,Tarjeta Crédito,Tarjeta de crédito,Gasto,Supermercado,Operacion
7/01/22,,"-36,87",EUR,Carref alcala madrid,Ing Direct,Tarjeta Crédito,Tarjeta de crédito,Gasto,Supermercado,Operacion
6/01/22,6/01/22,"-30,00",EUR,Transferencia bizum emitida,Ing Direct,Cuenta NÓMINA Principal,Cuenta,Gasto,Espectáculos,Entradas parque sofia
6/01/22,6/01/22,"-400,00",EUR,Traspaso periódico emitido nómina,Ing Direct,Cuenta NÓMINA Principal,Cuenta,No computable,Traspasos y transferencias,Spo to 2700287602
6/01/22,6/01/22,"400,00",EUR,Traspaso periódico recibido,Ing Direct,Imprevistos,Cuenta,No computable,Traspasos y transferencias,Spo from 1708097649
6/01/22,,"-69,59",EUR,Xoom luxembourg,Ing Direct,Tarjeta Crédito,Tarjeta de crédito,Gasto,Regalos,Operacion
6/01/22,,"-12,20",EUR,Pasteleria rechupete meco,Ing Direct,Tarjeta Claudia,Tarjeta de crédito,Gasto,Restaurante,Operacion
5/01/22,5/01/22,"-1.329,76",EUR,Cargo mensual tarjeta crédito,Ing Direct,Cuenta NÓMINA Principal,Cuenta,No computable,Tarjeta crédito,Liq. tarjeta crédito : 0160001
5/01/22,,"-10,50",EUR,Kinetike tomelloso,Ing Direct,Tarjeta Crédito,Tarjeta de crédito,Gasto,Espectáculos,Operacion
5/01/22,,"14,18",EUR,Abono en kinetike boadilla del,Ing Direct,Tarjeta Crédito,Tarjeta de crédito,Ingreso,Otros ingresos,Operacion
5/01/22,,"-14,18",EUR,Kinetike boadilla del,Ing Direct,Tarjeta Crédito,Tarjeta de crédito,Gasto,Espectáculos,Operacion
5/01/22,5/01/22,"-103,75",EUR,Univ.de alcala,ImaginBank,Antes cta .....2594,Cuenta,Gasto,Estudios,Alcalaaca0114059
4/01/22,3/01/22,"25,00",EUR,Abono bizum de carmen lucas dominguez,Sabadell,CUENTA EXPANSIÓN,Cuenta,Ingreso,Transferencias,9724_0016 2022-01-03 20:29:23
4/01/22,4/01/22,"-34,33",EUR,"Recibo banco cooperativo espanol, s.a.",Ing Direct,Cuenta NÓMINA Principal,Cuenta,Gasto,Óptica y dentista,Recibo de pr stamo 2038754855 periodo: 01-12-2021 al 01-01-2022.para mayor informaci n consulte a la entidad emisora del recibo.
4/01/22,,"-15,04",EUR,Avda union europea meco,Ing Direct,Tarjeta Crédito,Tarjeta de crédito,Gasto,Supermercado,Operacion
3/01/22,3/01/22,"-10,00",EUR,Adeudo recibo parroquia ntra. sra. del transito,Sabadell,CUENTA EXPANSIÓN,Cuenta,Gasto,Solidaridad,022901 038051977430000 01 p eur 02320138051977430000bsch057651722801000******5000
3/01/22,3/01/22,"-120,00",EUR,Transferencia bizum emitida,Ing Direct,Cuenta NÓMINA Principal,Cuenta,Gasto,Estudios,Luly noviembre y diciembre
3/01/22,3/01/22,"-300,00",EUR,Reintegro efectivo tarjeta la caixa 9737 meco es,Ing Direct,Cuenta NÓMINA Principal,Cuenta,Gasto,Otros vivienda,La caixa 9737 meco es
3/01/22,3/01/22,"-26,25",EUR,Recibo adeslas madrid,Ing Direct,Cuenta NÓMINA Principal,Cuenta,Gasto,Seguro salud,"Adeslas dental fam val:01.01.22-31.01.22 pneta:26,21 mes. clea:0,04 ips:0,00 copagos:0,00 poliza:282145990/0"
3/01/22,3/01/22,"-77,89",EUR,Recibo servicios financieros carrefour efc sa,Ing Direct,Cuenta NÓMINA Principal,Cuenta,Gasto,Electrónica,Financie-enero
3/01/22,3/01/22,"-350,00",EUR,Recibo fundacion colegio alborada,Ing Direct,Cuenta NÓMINA Principal,Cuenta,Gasto,Estudios,Cobro procedente de la factura 82953
3/01/22,3/01/22,"-9,30",EUR,Recibo digi spain telecom sl,Ing Direct,Cuenta NÓMINA Principal,Cuenta,Gasto,Móvil,Factura digi
3/01/22,3/01/22,"-13,24",EUR,Recibo metlife europe designated activitycompany,Ing Direct,Cuenta NÓMINA Principal,Cuenta,Gasto,Seguro vida,002021729******2874p:2203014569 p.net 12.20 con 0.04 clea 0.02 ips 0.98 mes vto 010122 politica privacidad www.metlife.es 900201040
3/01/22,3/01/22,"-0,40",EUR,Recibo telefonica moviles espana,Ing Direct,Cuenta NÓMINA Principal,Cuenta,Gasto,Móvil,Factura tuenti
3/01/22,3/01/22,"-9,34",EUR,Recibo telefonica moviles espana,Ing Direct,Cuenta NÓMINA Principal,Cuenta,Gasto,Móvil,Factura tuenti
3/01/22,3/01/22,"-136,44",EUR,Cargo cuota de préstamo,Ing Direct,Cuenta NÓMINA Principal,Cuenta,Gasto,Préstamos,Cargo cuota préstamo 7715027306/18
3/01/22,3/01/22,"-90,23",EUR,Cargo cuota de préstamo,Ing Direct,Cuenta NÓMINA Principal,Cuenta,Gasto,Préstamos,Cargo cuota préstamo 7712284698/32
3/01/22,,"-49,22",EUR,Avda union europea meco,Ing Direct,Tarjeta Claudia,Tarjeta de crédito,Gasto,Supermercado,Operacion
1/01/22,1/01/22,"0,24",EUR,Intereses a su favor,Ing Direct,Cuenta NARANJA,Cuenta,Ingreso,Rendimientos,
1/01/22,1/01/22,"0,01",EUR,Intereses a su favor,Ing Direct,Imprevistos,Cuenta,Ingreso,Rendimientos,
31/12/21,31/12/21,"-1.244,80",EUR,Recibo asteri nova s.l.,Ing Direct,Cuenta NÓMINA Principal,Cuenta,Gasto,Alquiler y compra,Ultimo recibo la gomera - diciembre (n. 15)
31/12/21,31/12/21,"-688,15",EUR,Recibo wizink bank s.a.u.,Ing Direct,Cuenta NÓMINA Principal,Cuenta,No computable,Tarjeta crédito,Pago mensual tarjeta 5267xxxxxxxx3740 liquidacion al dia : 28.12.2021
31/12/21,31/12/21,"-20,00",EUR,Ingreso fondos-planes,Ing Direct,Cuenta NÓMINA Principal,Cuenta,No computable,Inversiones,Aportaciones al plan: 4103616046-15-17
31/12/21,,"-3,57",EUR,Grupo ahorramas 1371,Ing Direct,Tarjeta Crédito,Tarjeta de crédito,Gasto,Supermercado,Autorizacion
31/12/21,,"-68,71",EUR,Avda union europea,Ing Direct,Tarjeta Crédito,Tarjeta de crédito,Gasto,Supermercado,Autorizacion
31/12/21,,"688,15",EUR,Pago recibo mes anterior,Wizink,WiZink Oro,Tarjeta de crédito,No computable,Tarjeta crédito,
27/12/21,27/12/21,"-350,00",EUR,Reintegro efectivo tarjeta la caixa 9737 meco es,Ing Direct,Cuenta NÓMINA Principal,Cuenta,Gasto,Otros vivienda,La caixa 9737 meco es
27/12/21,,"-4,49",EUR,Decathlon alcala,Ing Direct,Tarjeta Claudia,Tarjeta de crédito,Gasto,Material deportivo,Autorizacion
27/12/21,,"-44,12",EUR,Estacion servicio meco,Ing Direct,Tarjeta Claudia,Tarjeta de crédito,Gasto,Gasolina,Autorizacion
27/12/21,,"-11,25",EUR,Avda union europea,Wizink,WiZink Oro,Tarjeta de crédito,Gasto,Supermercado,
27/12/21,,"-9,99",EUR,Spotifyes p18b9b9e34,Wizink,WiZink Oro,Tarjeta de crédito,Gasto,Servicios y productos online,
26/12/21,,"-17,54",EUR,H&m0225,Ing Direct,Tarjeta Crédito,Tarjeta de crédito,Gasto,Ropa,Autorizacion
24/12/21,24/12/21,"3.846,31",EUR,"Nomina recibida audatex datos espana, s.a.",Ing Direct,Cuenta NÓMINA Principal,Cuenta,Ingreso,Nómina,
24/12/21,24/12/21,"-15,00",EUR,Intereses y/o comisiones,Sabadell,CUENTA EXPANSIÓN,Cuenta,Gasto,Cargos bancarios,
24/12/21,24/12/21,"-24,00",EUR,Transferencia bizum emitida,Ing Direct,Cuenta NÓMINA Principal,Cuenta,Gasto,Restaurante,Tamales familia plazas
24/12/21,,"-7,67",EUR,Adriley alimentacion sl,Ing Direct,Tarjeta Claudia,Tarjeta de crédito,Gasto,Supermercado,Autorizacion
24/12/21,,"-13,75",EUR,Grupo ahorramas 1371,Ing Direct,Tarjeta Claudia,Tarjeta de crédito,Gasto,Supermercado,Autorizacion
24/12/21,,"-41,16",EUR,Avda union europea,Ing Direct,Tarjeta Claudia,Tarjeta de crédito,Gasto,Supermercado,Autorizacion
23/12/21,,"-9,95",EUR,Zara alcala cc.alc.magna,Ing Direct,Tarjeta Claudia,Tarjeta de crédito,Gasto,Ropa,Autorizacion
22/12/21,22/12/21,"2.264,23",EUR,Nomina recibida h. principe de asturias,Ing Direct,Cuenta NÓMINA Cotitular Claudia - Compra Casa,Cuenta,Ingreso,Nómina,Paga: actual mas atrasos
22/12/21,22/12/21,"100,00",EUR,Transferencia recibida de a.e.a.t. devoluciones tributarias aeat apl:abono antic dedu familiares-fng21mod:143inf:familia numerosa gen 11-2021 exp:2021dev14329420435q aeat,Ing Direct,Cuenta NÓMINA Principal,Cuenta,Ingreso,Devolución impuestos,Aeat apl:abono antic dedu familiares-fng21mod:143inf:familia numerosa gen 11-2021 exp:2021dev14329420435q aeat
22/12/21,,"-5,30",EUR,Mercadona alcala atenea,Ing Direct,Tarjeta Claudia,Tarjeta de crédito,Gasto,Supermercado,Autorizacion
22/12/21,,"-12,45",EUR,Alimentacion extranjero,Wizink,WiZink Oro,Tarjeta de crédito,Gasto,Supermercado,
22/12/21,,"-13,18",EUR,Carref mini alcala,Wizink,WiZink Oro,Tarjeta de crédito,Gasto,Supermercado,
22/12/21,,"-9,74",EUR,Avda union europea,Wizink,WiZink Oro,Tarjeta de crédito,Gasto,Supermercado,
22/12/21,,"-38,68",EUR,Grupo ahorramas 1371,Wizink,WiZink Oro,Tarjeta de crédito,Gasto,Supermercado,
21/12/21,21/12/21,"-59,99",EUR,Recibo vodafone,Ing Direct,Cuenta NÓMINA Principal,Cuenta,Gasto,Internet,Factura: yi21-021169116/
21/12/21,,"-29,99",EUR,Pull and bear,Ing Direct,Tarjeta Claudia,Tarjeta de crédito,Gasto,Ropa,Autorizacion
21/12/21,,"-32,99",EUR,Springfield mixta,Ing Direct,Tarjeta Claudia,Tarjeta de crédito,Gasto,Ropa,Autorizacion
21/12/21,,"24,99",EUR,Abono en springfield mixta,Ing Direct,Tarjeta Claudia,Tarjeta de crédito,Gasto,Ropa,Autorizacion
21/12/21,,"-24,99",EUR,Springfield mixta,Ing Direct,Tarjeta Claudia,Tarjeta de crédito,Gasto,Ropa,Autorizacion
21/12/21,,"-69,90",EUR,Oldei alcala,Ing Direct,Tarjeta Claudia,Tarjeta de crédito,Gasto,Ropa,Autorizacion
21/12/21,,"-23,57",EUR,Mercadona cc alcala magna,Ing Direct,Tarjeta Claudia,Tarjeta de crédito,Gasto,Supermercado,Autorizacion
21/12/21,,"-2,85",EUR,Bombon boss alcala de h,Ing Direct,Tarjeta Claudia,Tarjeta de crédito,Gasto,Restaurante,Autorizacion
21/12/21,,"-22,00",EUR,Farmacia carrefour alcala,Wizink,WiZink Oro,Tarjeta de crédito,Gasto,Farmacia,
21/12/21,,"-26,40",EUR,Carref alcala,Wizink,WiZink Oro,Tarjeta de crédito,Gasto,Supermercado,
20/12/21,20/12/21,"-125,00",EUR,Transferencia emitida periódica,Ing Direct,Cuenta NÓMINA Principal,Cuenta,No computable,Traspasos y transferencias,Transferencia universidad
20/12/21,,"-13,14",EUR,Avda union europea,Ing Direct,Tarjeta Claudia,Tarjeta de crédito,Gasto,Supermercado,Autorizacion
20/12/21,20/12/21,"125,00",EUR,Transfer - transferencia universidad,ImaginBank,Antes cta .....2594,Cuenta,Gasto,Estudios,Origen: 14650100
18/12/21,,"-25,49",EUR,Amzn mktp es*v99ym7tc5,Wizink,WiZink Oro,Tarjeta de crédito,Gasto,Regalos,
18/12/21,,"-58,21",EUR,Avda union europea,Wizink,WiZink Oro,Tarjeta de crédito,Gasto,Supermercado,
17/12/21,,"-9,99",EUR,Amzn mktp es*a59ad7j85,Wizink,WiZink Oro,Tarjeta de crédito,Gasto,Electrónica,
17/12/21,,"-44,95",EUR,Www zalando es,Wizink,WiZink Oro,Tarjeta de crédito,Gasto,Ropa,
17/12/21,,"-79,28",EUR,Estacion servicio meco,Wizink,WiZink Oro,Tarjeta de crédito,Gasto,Gasolina,
17/12/21,,"-25,70",EUR,Avda union europea,Wizink,WiZink Oro,Tarjeta de crédito,Gasto,Supermercado,
16/12/21,16/12/21,"-1.244,80",EUR,Recibo asteri nova s.l.,Ing Direct,Cuenta NÓMINA Principal,Cuenta,Gasto,Alquiler y compra,Ultimo recibo la gomera - diciembre (n. 15)
16/12/21,,"-153,62",EUR,Talleres busmacar,Ing Direct,Tarjeta Claudia,Tarjeta de crédito,Gasto,Mantenimiento vehículo,Autorizacion
16/12/21,,"-130,00",EUR,Cuota servicio compra facil,Wizink,WiZink Oro,Tarjeta de crédito,Gasto,Hotel,
15/12/21,,"-3,80",EUR,Se correos y telegrafos s,Ing Direct,Tarjeta Claudia,Tarjeta de crédito,Gasto,Otros servicios,Autorizacion
14/12/21,14/12/21,"-7.768,96",EUR,Transferencia emitida a perse primer pago cocina javier plazas,Ing Direct,Cuenta NÓMINA Principal,Cuenta,Gasto,Hogar,Primer pago cocina javier plazas
14/12/21,,"-9,77",EUR,Amzn mktp es*8g44642g5,Wizink,WiZink Oro,Tarjeta de crédito,Gasto,Electrónica,
13/12/21,,"-3,70",EUR,Madrid sur movilidad iii,Ing Direct,Tarjeta Crédito,Tarjeta de crédito,Gasto,Parking y peaje,Autorizacion
13/12/21,,"-1,90",EUR,Atpseitt meco >m 50s madrid,Ing Direct,Tarjeta Claudia,Tarjeta de crédito,Gasto,Restaurante,Operacion
12/12/21,,"-4,50",EUR,Costco wholesale spain s,Ing Direct,Tarjeta Crédito,Tarjeta de crédito,Gasto,Supermercado,Autorizacion
12/12/21,,"-181,32",EUR,Costco wholesale spain s,Ing Direct,Tarjeta Crédito,Tarjeta de crédito,Gasto,Supermercado,Autorizacion
12/12/21,,"-47,94",EUR,Costco gasolinera getafe,Ing Direct,Tarjeta Crédito,Tarjeta de crédito,Gasto,Gasolina,Autorizacion
11/12/21,,"-11,99",EUR,Pago en hpi instant ink spain www.hp.com,Ing Direct,Tarjeta Crédito,Tarjeta de crédito,Gasto,Préstamos,Operacion
11/12/21,,"-59,43",EUR,Pago en avda union europea meco,Ing Direct,Tarjeta Crédito,Tarjeta de crédito,Gasto,Restaurante,Operacion
10/12/21,,"-20,56",EUR,Avda union europea,Ing Direct,Tarjeta Crédito,Tarjeta de crédito,Gasto,Supermercado,Autorizacion
9/12/21,9/12/21,"-242,87",EUR,"Recibo volkswagen bank, gmbh s.e.",Ing Direct,Cuenta NÓMINA Principal,Cuenta,Gasto,Compra vehículo,"Vcto. 09/12/2021, contrato: 01fi50031252,atencion cliente volkswagen bank : 914279900,el pago de este recibo no implica pagos anteriores."
9/12/21,,"-17,20",EUR,Mercadona cc alcala magna,Ing Direct,Tarjeta Claudia,Tarjeta de crédito,Gasto,Supermercado,Autorizacion
9/12/21,,"-12,00",EUR,Kiko,Ing Direct,Tarjeta Claudia,Tarjeta de crédito,Gasto,Belleza,Autorizacion
7/12/21,7/12/21,"-103,75",EUR,Univ.de alcala,ImaginBank,Antes cta .....2594,Cuenta,Gasto,Estudios,Alcalaaca0114059
6/12/21,6/12/21,"-400,00",EUR,Traspaso periódico emitido nómina,Ing Direct,Cuenta NÓMINA Principal,Cuenta,No computable,Traspasos y transferencias,Spo to 2700287602
6/12/21,6/12/21,"400,00",EUR,Traspaso periódico recibido,Ing Direct,Imprevistos,Cuenta,No computable,Traspasos y transferencias,Spo from 1708097649
5/12/21,5/12/21,"-1.778,58",EUR,Cargo mensual tarjeta crédito,Ing Direct,Cuenta NÓMINA Principal,Cuenta,No computable,Tarjeta crédito,Liq. tarjeta crédito : 0160001
5/12/21,,"-27,50",EUR,Kinetike,Ing Direct,Tarjeta Crédito,Tarjeta de crédito,Gasto,Espectáculos,Autorizacion
5/12/21,,"-20,98",EUR,Muy mucho fontanella,Ing Direct,Tarjeta Crédito,Tarjeta de crédito,Gasto,Hogar,Autorizacion
5/12/21,,"-9,00",EUR,Miniso oasiz,Ing Direct,Tarjeta Crédito,Tarjeta de crédito,Gasto,Regalos,Autorizacion
5/12/21,,"-12,00",EUR,Miniso oasiz,Ing Direct,Tarjeta Claudia,Tarjeta de crédito,Gasto,Regalos,Autorizacion
4/12/21,4/12/21,"-9,40",EUR,Transferencia bizum emitida,Ing Direct,Cuenta NÓMINA Principal,Cuenta,Gasto,Transferencias,Claudia buendia
4/12/21,,"-5,39",EUR,Avda union europea,Ing Direct,Tarjeta Crédito,Tarjeta de crédito,Gasto,Supermercado,Autorizacion
4/12/21,,"-83,44",EUR,Avda union europea,Ing Direct,Tarjeta Crédito,Tarjeta de crédito,Gasto,Supermercado,Autorizacion
3/12/21,3/12/21,"-136,44",EUR,Cargo cuota de préstamo,Ing Direct,Cuenta NÓMINA Principal,Cuenta,Gasto,Préstamos,Cargo cuota préstamo 7715027306/17
3/12/21,3/12/21,"-90,23",EUR,Cargo cuota de préstamo,Ing Direct,Cuenta NÓMINA Principal,Cuenta,Gasto,Préstamos,Cargo cuota préstamo 7712284698/31
3/12/21,,"-18,69",EUR,Avda union europea,Ing Direct,Tarjeta Claudia,Tarjeta de crédito,Gasto,Supermercado,Autorizacion
3/12/21,,"-160,00",EUR,Mecovision,Ing Direct,Tarjeta Claudia,Tarjeta de crédito,Gasto,Óptica y dentista,Autorizacion
2/12/21,2/12/21,"-350,00",EUR,Recibo fundacion colegio alborada,Ing Direct,Cuenta NÓMINA Principal,Cuenta,Gasto,Estudios,Cobro procedente de la factura 79534
2/12/21,2/12/21,"-26,25",EUR,Recibo adeslas madrid,Ing Direct,Cuenta NÓMINA Principal,Cuenta,Gasto,Seguro salud,"Adeslas dental fam val:01.12.21-31.12.21 pneta:26,21 mes. clea:0,04 ips:0,00 copagos:0,00 poliza:282145990/0"
2/12/21,2/12/21,"-34,33",EUR,"Recibo banco cooperativo espanol, s.a.",Ing Direct,Cuenta NÓMINA Principal,Cuenta,Gasto,Óptica y dentista,Recibo de pr stamo 2038754855 periodo: 01-11-2021 al 01-12-2021.para mayor informaci n consulte a la entidad emisora del recibo.
2/12/21,2/12/21,"-500,00",EUR,Reintegro efectivo tarjeta la caixa 1359 meco es,Ing Direct,Cuenta NÓMINA Principal,Cuenta,Gasto,Otros vivienda,La caixa 1359 meco es
1/12/21,1/12/21,"-10,00",EUR,Adeudo recibo parroquia ntra. sra. del transito,Sabadell,CUENTA EXPANSIÓN,Cuenta,Gasto,Solidaridad,022901 038013102820000 01 p eur 02320138013102820000bsch057651722801000******0000
1/12/21,1/12/21,"0,23",EUR,Intereses a su favor,Ing Direct,Cuenta NARANJA,Cuenta,Ingreso,Rendimientos,
1/12/21,1/12/21,"-77,89",EUR,Recibo servicios financieros carrefour efc sa,Ing Direct,Cuenta NÓMINA Principal,Cuenta,Gasto,Electrónica,Financie-diciembr
1/12/21,1/12/21,"-13,24",EUR,Recibo metlife europe designated activitycompany,Ing Direct,Cuenta NÓMINA Principal,Cuenta,Gasto,Seguro vida,002021729******6044p:2203014569 p.net 12.20 con 0.04 clea 0.02 ips 0.98 mes vto 011221 politica privacidad www.metlife.es 900201040
1/12/21,1/12/21,"-37,54",EUR,Recibo telefonica moviles espana,Ing Direct,Cuenta NÓMINA Principal,Cuenta,Gasto,Móvil,Factura tuenti
1/12/21,1/12/21,"-4,61",EUR,Recibo telefonica moviles espana,Ing Direct,Cuenta NÓMINA Principal,Cuenta,Gasto,Móvil,Factura tuenti
1/12/21,1/12/21,"-9,75",EUR,Recibo telefonica moviles espana,Ing Direct,Cuenta NÓMINA Principal,Cuenta,Gasto,Móvil,Factura tuenti
1/12/21,1/12/21,"-0,58",EUR,Recibo digi spain telecom sl,Ing Direct,Cuenta NÓMINA Principal,Cuenta,Gasto,Móvil,Factura digi
1/12/21,1/12/21,"-44,97",EUR,"Recibo endesa energia, s.a.",Ing Direct,Cuenta NÓMINA Principal,Cuenta,Gasto,Gas,Facturas de gas pmo108n0241707 y pmo109n0053719 contrato 012162262388 de endesa energia sau
1/12/21,,"-2,87",EUR,Fcia. garcia alonso,Ing Direct,Tarjeta Claudia,Tarjeta de crédito,Gasto,Farmacia,Autorizacion
1/12/21,,"-7,95",EUR,Calzedonia alcala magna,Ing Direct,Tarjeta Claudia,Tarjeta de crédito,Gasto,Ropa,Autorizacion
30/11/21,30/11/21,"-731,29",EUR,Recibo wizink bank s.a.u.,Ing Direct,Cuenta NÓMINA Principal,Cuenta,No computable,Tarjeta crédito,Pago mensual tarjeta 5267xxxxxxxx3740 liquidacion al dia : 25.11.2021
30/11/21,30/11/21,"-20,00",EUR,Ingreso fondos-planes,Ing Direct,Cuenta NÓMINA Principal,Cuenta,No computable,Inversiones,Aportaciones al plan: 4103616046-15-16
30/11/21,,"731,29",EUR,Pago recibo mes anterior,Wizink,WiZink Oro,Tarjeta de crédito,No computable,Tarjeta crédito,
29/11/21,29/11/21,"-10,00",EUR,Transferencia bizum emitida,Ing Direct,Cuenta NÓMINA Principal,Cuenta,Gasto,Regalos,Regalo mireya
29/11/21,,"-69,20",EUR,Estacion servicio meco,Ing Direct,Tarjeta Crédito,Tarjeta de crédito,Gasto,Gasolina,Autorizacion
29/11/21,,"-7,26",EUR,Fcia. garcia alonso,Ing Direct,Tarjeta Claudia,Tarjeta de crédito,Gasto,Farmacia,Autorizacion
29/11/21,,"-40,00",EUR,Estacion servicio meco,Ing Direct,Tarjeta Claudia,Tarjeta de crédito,Gasto,Gasolina,Autorizacion
29/11/21,,"-33,62",EUR,Amazon.es*d87349fb5,Wizink,WiZink Oro,Tarjeta de crédito,Gasto,Servicios y productos online,
28/11/21,28/11/21,"-15,00",EUR,Transferencia bizum emitida,Ing Direct,Cuenta NÓMINA Principal,Cuenta,Gasto,Estudios,Fotocopias
28/11/21,28/11/21,"-13,00",EUR,Transferencia bizum emitida,Ing Direct,Cuenta NÓMINA Principal,Cuenta,Gasto,Regalos,Regalo gloria
28/11/21,,"-12,60",EUR,Tienda alcala magna,Ing Direct,Tarjeta Claudia,Tarjeta de crédito,Gasto,Regalos,Autorizacion
28/11/21,,"-17,90",EUR,Hug and clau cc alcala ma,Ing Direct,Tarjeta Claudia,Tarjeta de crédito,Gasto,Ropa,Autorizacion
28/11/21,,"-93,09",EUR,Springfield mixta,Wizink,WiZink Oro,Tarjeta de crédito,Gasto,Ropa,
28/11/21,,"-3,00",EUR,Tienda alcala magna,Wizink,WiZink Oro,Tarjeta de crédito,Gasto,Otras compras,
27/11/21,27/11/21,"1.392,63",EUR,Nomina recibida h. principe de asturias,Ing Direct,Cuenta NÓMINA Cotitular Claudia - Compra Casa,Cuenta,Ingreso,Nómina,Paga: actual mas atrasos
27/11/21,,"-9,99",EUR,Spotifyes p182ece86e,Wizink,WiZink Oro,Tarjeta de crédito,Gasto,Servicios y productos online,
27/11/21,,"-40,00",EUR,Restaurante panorama,Wizink,WiZink Oro,Tarjeta de crédito,Gasto,Restaurante,
27/11/21,,"-9,00",EUR,Atuel,Wizink,WiZink Oro,Tarjeta de crédito,Gasto,Restaurante,
27/11/21,,"-138,40",EUR,Avda union europea,Wizink,WiZink Oro,Tarjeta de crédito,Gasto,Supermercado,
26/11/21,26/11/21,"100,00",EUR,Transferencia recibida de a.e.a.t. devoluciones tributarias aeat apl:abono antic dedu familiares-fng21mod:143inf:familia numerosa gen 10-2021 exp:2021dev14329420393c aeat,Ing Direct,Cuenta NÓMINA Principal,Cuenta,Ingreso,Devolución impuestos,Aeat apl:abono antic dedu familiares-fng21mod:143inf:familia numerosa gen 10-2021 exp:2021dev14329420393c aeat
26/11/21,,"-0,60",EUR,Venpay spa,Ing Direct,Tarjeta Crédito,Tarjeta de crédito,Gasto,Restaurante,Autorizacion
25/11/21,25/11/21,"-170,43",EUR,Recibo linea directa aseguradora s.a.,Ing Direct,Cuenta NÓMINA Principal,Cuenta,Gasto,Seguro auto,Pago: anual 41026941 vigencia: del 23-11-21 al 23-11-22 incluye seguro obligatorio y riesgos extraordinarios. ley 30/95 vh: 6917 dsr
25/11/21,25/11/21,"59,10",EUR,"Transferencia recibida de ayuntamiento de meco plazas buendia, lucia. beca estudios de educacion primaria, secundaria, bachillerato y formacion profesional basica y grado medio curso 2021",Ing Direct,Cuenta NÓMINA Principal,Cuenta,Gasto,Estudios,"Plazas buendia, lucia. beca estudios de educacion primaria, secundaria, bachillerato y formacion profesional basica y grado medio curso 2021"
24/11/21,24/11/21,"3.791,01",EUR,"Nomina recibida audatex datos espana, s.a.",Ing Direct,Cuenta NÓMINA Principal,Cuenta,Ingreso,Nómina,
24/11/21,,"-11,09",EUR,Asia store spain sl,Ing Direct,Tarjeta Claudia,Tarjeta de crédito,Gasto,Hogar,Autorizacion
24/11/21,,"-18,09",EUR,Lefties,Ing Direct,Tarjeta Claudia,Tarjeta de crédito,Gasto,Ropa,Autorizacion
24/11/21,,"-25,52",EUR,K63 alcala magna,Ing Direct,Tarjeta Claudia,Tarjeta de crédito,Gasto,Ropa,Autorizacion
24/11/21,,"-7,95",EUR,Calzedonia alcala magna,Ing Direct,Tarjeta Claudia,Tarjeta de crédito,Gasto,Ropa,Autorizacion
21/11/21,,"-37,65",EUR,Restaurante asiatico,Wizink,WiZink Oro,Tarjeta de crédito,Gasto,Restaurante,
20/11/21,,"-63,50",EUR,Estacion servicio meco,Wizink,WiZink Oro,Tarjeta de crédito,Gasto,Gasolina,
20/11/21,,"-101,23",EUR,Avda union europea,Wizink,WiZink Oro,Tarjeta de crédito,Gasto,Supermercado,
19/11/21,19/11/21,"-160,00",EUR,Recibo fundacion colegio alborada,Ing Direct,Cuenta NÓMINA Principal,Cuenta,Gasto,Estudios,Cobro procedente de la factura 77705
19/11/21,19/11/21,"-96,98",EUR,Recibo vodafone,Ing Direct,Cuenta NÓMINA Principal,Cuenta,Gasto,Internet,Factura: yi21-019523299/
19/11/21,19/11/21,"-125,00",EUR,Transferencia emitida periódica,Ing Direct,Cuenta NÓMINA Principal,Cuenta,No computable,Traspasos y transferencias,Transferencia universidad
19/11/21,19/11/21,"125,00",EUR,Transfer - transferencia universidad,ImaginBank,Antes cta .....2594,Cuenta,Gasto,Estudios,Origen: 14650100
18/11/21,17/11/21,"-17,00",EUR,Bizum patricia daniela pasquier,Sabadell,CUENTA EXPANSIÓN,Cuenta,Gasto,Estudios,9724_0016 2021-11-17 21:27:39
18/11/21,18/11/21,"-93,00",EUR,Recibo fundacion colegio alborada,Ing Direct,Cuenta NÓMINA Principal,Cuenta,Gasto,Estudios,Cobro procedente de la factura 76761
18/11/21,,"-5,03",EUR,Avda union europea,Ing Direct,Tarjeta Claudia,Tarjeta de crédito,Gasto,Supermercado,Autorizacion
17/11/21,,"-5,00",EUR,Venpay spa,Ing Direct,Tarjeta Crédito,Tarjeta de crédito,Gasto,Restaurante,Autorizacion
17/11/21,,"-35,00",EUR,Estacion servicio meco,Ing Direct,Tarjeta Claudia,Tarjeta de crédito,Gasto,Gasolina,Autorizacion
17/11/21,,"-31,33",EUR,Avda union europea,Ing Direct,Tarjeta Claudia,Tarjeta de crédito,Gasto,Supermercado,Autorizacion
17/11/21,,"-18,90",EUR,Fcia. garcia alonso,Wizink,WiZink Oro,Tarjeta de crédito,Gasto,Farmacia,
16/11/21,16/11/21,"-82,42",EUR,"Recibo ocaso, s.a. seguros/reaseguros madrid",Ing Direct,Cuenta NÓMINA Principal,Cuenta,Gasto,Seguro vida,Inicio periodo 30/11/21 pago trim vida riesgo 10100 2428451 r758 info privacidad y proteccion de datos en www.ocaso.es/datos
16/11/21,16/11/21,"-82,42",EUR,"Recibo ocaso, s.a. seguros/reaseguros madrid",Ing Direct,Cuenta NÓMINA Principal,Cuenta,Gasto,Seguro vida,Inicio periodo 30/11/21 pago trim vida riesgo 10100 2428436 r756 info privacidad y proteccion de datos en www.ocaso.es/datos
16/11/21,16/11/21,"-85,53",EUR,"Recibo ocaso, s.a. seguros/reaseguros madrid",Ing Direct,Cuenta NÓMINA Principal,Cuenta,Gasto,Seguro vida,Inicio periodo 21/11/21 pago seme vida riesgo 10100 2428450 r757 info privacidad y proteccion de datos en www.ocaso.es/datos
16/11/21,,"-130,00",EUR,Cuota servicio compra facil,Wizink,WiZink Oro,Tarjeta de crédito,Gasto,Hotel,
13/11/21,,"-122,57",EUR,Avda union europea,Ing Direct,Tarjeta Crédito,Tarjeta de crédito,Gasto,Supermercado,Autorizacion
12/11/21,,"-6,85",EUR,Avda union europea,Ing Direct,Tarjeta Crédito,Tarjeta de crédito,Gasto,Supermercado,Autorizacion
11/11/21,,"-4,99",EUR,Hpi instant ink spain,Ing Direct,Tarjeta Crédito,Tarjeta de crédito,Gasto,Servicios y productos online,Autorizacion
11/11/21,,"-97,82",EUR,Worldtrips,Ing Direct,Tarjeta Crédito,Tarjeta de crédito,Gasto,Seguro salud,Autorizacion
11/11/21,,"-8,80",EUR,Bkt-mad-park-o-ca,Ing Direct,Tarjeta Crédito,Tarjeta de crédito,Gasto,Parking y peaje,Autorizacion
11/11/21,,"-319,72",EUR,Eurodivisas t4 barajas,Ing Direct,Tarjeta Crédito,Tarjeta de crédito,Gasto,Otros gastos,Autorizacion  viaje nata
11/11/21,,"-69,30",EUR,Mc donald s barajas tierr,Ing Direct,Tarjeta Crédito,Tarjeta de crédito,Gasto,Restaurante,Autorizacion
11/11/21,,"-12,52",EUR,Uscustoms esta appl pm,Ing Direct,Tarjeta Crédito,Tarjeta de crédito,Gasto,Otros organismos,Autorizacion  visado esta
11/11/21,,"-1,90",EUR,Atpseitt m 50n >meco madrid,Ing Direct,Tarjeta Crédito,Tarjeta de crédito,Gasto,Parking y peaje,Operacion
11/11/21,,"-0,60",EUR,Atpseitt alcobenda >alco madrid,Ing Direct,Tarjeta Crédito,Tarjeta de crédito,Gasto,Parking y peaje,Operacion
11/11/21,,"-0,60",EUR,Atpseitt alcobenda >alco madrid,Ing Direct,Tarjeta Crédito,Tarjeta de crédito,Gasto,Parking y peaje,Operacion
11/11/21,,"-1,90",EUR,Atpseitt meco >m 50n madrid,Ing Direct,Tarjeta Crédito,Tarjeta de crédito,Gasto,Parking y peaje,Operacion
10/11/21,9/11/21,"-96,00",EUR,Bizum maria julia di benedetto,Sabadell,CUENTA EXPANSIÓN,Cuenta,Gasto,Estudios,9724_0016 2021-11-09 19:53:59
10/11/21,10/11/21,"9.310,00",EUR,Transferencia recibida de javier hernando plazas becerra bonus 2021,Ing Direct,Cuenta NÓMINA Principal,Cuenta,No computable,Traspasos y transferencias,Bonus 2021
10/11/21,,"-60,00",EUR,Iberia pago seguro,Ing Direct,Tarjeta Crédito,Tarjeta de crédito,Gasto,Transportes,Autorizacion
10/11/21,,"-15,66",EUR,Loteria inteligente,Ing Direct,Tarjeta Crédito,Tarjeta de crédito,Gasto,Loterías,Autorizacion
10/11/21,,"-1,30",EUR,Fcia. garcia alonso,Ing Direct,Tarjeta Claudia,Tarjeta de crédito,Gasto,Farmacia,Autorizacion
9/11/21,9/11/21,"-10,00",EUR,Adeudo recibo parroquia ntra. sra. del transito,Sabadell,CUENTA EXPANSIÓN,Cuenta,Gasto,Solidaridad,022901 037112693180000 01 p eur 02320137112693180000bsch057651722801000******3000
9/11/21,9/11/21,"9.309,05",EUR,"Nomina audatex datos espana, s.a.",Sabadell,CUENTA EXPANSIÓN,Cuenta,Ingreso,Nómina,022901 037112687970000 01 p eur 02320137112687970000bkbk097070009401000******3000
9/11/21,9/11/21,"-198,34",EUR,Recibo linea directa aseguradora s.a.,Ing Direct,Cuenta NÓMINA Principal,Cuenta,Gasto,Seguro hogar,"Pol,04176835.valido 06/11/21-06/11/22.recibo 1 de 1 av/ la luz, 1 4 d 28880 meco"
9/11/21,9/11/21,"-242,87",EUR,"Recibo volkswagen bank, gmbh s.e.",Ing Direct,Cuenta NÓMINA Principal,Cuenta,Gasto,Compra vehículo,"Vcto. 09/11/2021, contrato: 01fi50031252,atencion cliente volkswagen bank : 914279900,el pago de este recibo no implica pagos anteriores."
9/11/21,9/11/21,"-9.310,00",EUR,Transferencia a javier hernando plazas becerra,Sabadell,CUENTA EXPANSIÓN,Cuenta,No computable,Traspasos y transferencias,751983045
9/11/21,,"-67,31",EUR,Estacion servicio meco,Ing Direct,Tarjeta Crédito,Tarjeta de crédito,Gasto,Gasolina,Autorizacion
9/11/21,,"-49,02",EUR,Mercadona espartales,Ing Direct,Tarjeta Crédito,Tarjeta de crédito,Gasto,Supermercado,Autorizacion
8/11/21,7/11/21,"21,00",EUR,Abono bizum de julia polaina lopez,Sabadell,CUENTA EXPANSIÓN,Cuenta,Gasto,Otros ocio,9724_0016 2021-11-07 13:27:12
8/11/21,6/11/21,"52,00",EUR,Abono bizum de isaac luque baltasar,Sabadell,CUENTA EXPANSIÓN,Cuenta,Ingreso,Transferencias,9724_0016 2021-11-06 18:42:54
8/11/21,8/11/21,"21,00",EUR,Abono bizum de leyre gomez pantoja guemes,Sabadell,CUENTA EXPANSIÓN,Cuenta,Gasto,Otros ocio,9724_0016 2021-11-08 17:40:40
8/11/21,8/11/21,"21,00",EUR,Abono bizum de miguel angel peno escudero,Sabadell,CUENTA EXPANSIÓN,Cuenta,Gasto,Otros ocio,9724_0016 2021-11-08 17:38:59
8/11/21,,"-19,99",EUR,Inspiral,Ing Direct,Tarjeta Crédito,Tarjeta de crédito,Gasto,Electrónica,Autorizacion
8/11/21,,"-12,50",EUR,Ferreteria acas,Ing Direct,Tarjeta Claudia,Tarjeta de crédito,Gasto,Hogar,Autorizacion
7/11/21,,"-105,00",EUR,The room escape madrid,Ing Direct,Tarjeta Crédito,Tarjeta de crédito,Gasto,Otros ocio,Autorizacion
6/11/21,6/11/21,"-400,00",EUR,Traspaso periódico emitido nómina,Ing Direct,Cuenta NÓMINA Principal,Cuenta,No computable,Traspasos y transferencias,Spo to 2700287602
6/11/21,6/11/21,"400,00",EUR,Traspaso periódico recibido,Ing Direct,Imprevistos,Cuenta,No computable,Traspasos y transferencias,Spo from 1708097649
6/11/21,6/11/21,"-120,00",EUR,Reintegro efectivo tarjeta ing bank alcala de henes,Ing Direct,Cuenta NÓMINA Principal,Cuenta,Gasto,Efectivo,Ing bank alcala de henes
6/11/21,6/11/21,"-80,00",EUR,Reintegro efectivo tarjeta ing bank alcala de henes,Ing Direct,Cuenta NÓMINA Principal,Cuenta,Gasto,Mantenimiento hogar,Ing bank alcala de henes
6/11/21,,"-26,58",EUR,Grupo ahorramas 1371,Ing Direct,Tarjeta Crédito,Tarjeta de crédito,Gasto,Supermercado,Autorizacion
6/11/21,,"-143,00",EUR,Norauto alcala,Ing Direct,Tarjeta Crédito,Tarjeta de crédito,Gasto,Mantenimiento vehículo,Autorizacion
6/11/21,,"-50,09",EUR,Pull and bear,Ing Direct,Tarjeta Claudia,Tarjeta de crédito,Gasto,Ropa,Autorizacion
5/11/21,5/11/21,"-32,45",EUR,Recibo ayuntamiento de meco,Ing Direct,Cuenta NÓMINA Principal,Cuenta,Gasto,Ayuntamiento,S.e.p. personas fisicas. plazo 5 de 5 de 2021 exp. 0000011637
5/11/21,5/11/21,"-1.231,99",EUR,Cargo mensual tarjeta crédito,Ing Direct,Cuenta NÓMINA Principal,Cuenta,No computable,Tarjeta crédito,Liq. tarjeta crédito : 0160001
5/11/21,,"-53,00",EUR,Estacion servicio meco,Ing Direct,Tarjeta Crédito,Tarjeta de crédito,Gasto,Gasolina,Autorizacion
5/11/21,,"-57,41",EUR,Avda union europea,Ing Direct,Tarjeta Crédito,Tarjeta de crédito,Gasto,Supermercado,Autorizacion
5/11/21,5/11/21,"-103,75",EUR,Universidad de al - universidad de al,ImaginBank,Antes cta .....2594,Cuenta,Gasto,Estudios,Q2818018j
4/11/21,4/11/21,"-12,50",EUR,Transferencia emitida sandra martin,Ing Direct,Cuenta NÓMINA Principal,Cuenta,Gasto,Deporte,Natalia plazas noviembre
4/11/21,4/11/21,"-5,00",EUR,Traspaso bizum emitido,Ing Direct,Cuenta NÓMINA Principal,Cuenta,Gasto,Regalos,Regalo miguel angel
4/11/21,,"-15,60",EUR,Fcia. garcia alonso,Ing Direct,Tarjeta Claudia,Tarjeta de crédito,Gasto,Farmacia,Autorizacion
3/11/21,3/11/21,"-136,44",EUR,Cargo cuota de préstamo,Ing Direct,Cuenta NÓMINA Principal,Cuenta,Gasto,Préstamos,Cargo cuota préstamo 7715027306/16
3/11/21,3/11/21,"-90,23",EUR,Cargo cuota de préstamo,Ing Direct,Cuenta NÓMINA Principal,Cuenta,Gasto,Préstamos,Cargo cuota préstamo 7712284698/30
3/11/21,,"-5,16",EUR,Store asia s.l.,Ing Direct,Tarjeta Claudia,Tarjeta de crédito,Gasto,Hogar,Autorizacion
2/11/21,2/11/21,"-34,33",EUR,"Recibo banco cooperativo espanol, s.a.",Ing Direct,Cuenta NÓMINA Principal,Cuenta,Gasto,Óptica y dentista,Recibo de pr stamo 2038754855 periodo: 01-10-2021 al 01-11-2021.para mayor informaci n consulte a la entidad emisora del recibo.
2/11/21,2/11/21,"-350,00",EUR,Recibo fundacion colegio alborada,Ing Direct,Cuenta NÓMINA Principal,Cuenta,Gasto,Estudios,Cobro procedente de la factura 72788
2/11/21,2/11/21,"-13,24",EUR,Recibo metlife europe designated activitycompany,Ing Direct,Cuenta NÓMINA Principal,Cuenta,Gasto,Seguro vida,002021728******7696p:2203014569 p.net 12.20 con 0.04 clea 0.02 ips 0.98 mes vto 011121 politica privacidad www.metlife.es 900201040
2/11/21,,"-29,62",EUR,Avda union europea,Ing Direct,Tarjeta Claudia,Tarjeta de crédito,Gasto,Supermercado,Autorizacion
2/11/21,,"-19,98",EUR,Greenwich alcala,Ing Direct,Tarjeta Claudia,Tarjeta de crédito,Gasto,Ropa,Autorizacion
2/11/21,,"-114,99",EUR,Greenwich alcala,Ing Direct,Tarjeta Claudia,Tarjeta de crédito,Gasto,Hogar,Autorizacion
2/11/21,2/11/21,"-20,00",EUR,Suscripción de fondos,Ing Direct,Cuenta NÓMINA Principal,Cuenta,No computable,Inversiones,Aportaciones al plan: 4103616046-15-15
1/11/21,1/11/21,"0,19",EUR,Intereses a su favor,Ing Direct,Cuenta NARANJA,Cuenta,Ingreso,Rendimientos,
1/11/21,1/11/21,"-26,25",EUR,Recibo adeslas madrid,Ing Direct,Cuenta NÓMINA Principal,Cuenta,Gasto,Seguro salud,"Adeslas dental fam val:01.11.21-30.11.21 pneta:26,21 mes. clea:0,04 ips:0,00 copagos:0,00 poliza:282145990/0"
1/11/21,1/11/21,"-77,89",EUR,Recibo servicios financieros carrefour efc sa,Ing Direct,Cuenta NÓMINA Principal,Cuenta,Gasto,Electrónica,Financie-noviembr
1/11/21,1/11/21,"-6,75",EUR,Recibo telefonica moviles espana,Ing Direct,Cuenta NÓMINA Principal,Cuenta,Gasto,Móvil,Factura tuenti
1/11/21,1/11/21,"-10,55",EUR,Recibo telefonica moviles espana,Ing Direct,Cuenta NÓMINA Principal,Cuenta,Gasto,Móvil,Factura tuenti
1/11/21,1/11/21,"-5,95",EUR,Recibo telefonica moviles espana,Ing Direct,Cuenta NÓMINA Principal,Cuenta,Gasto,Móvil,Factura tuenti
1/11/21,1/11/21,"0,01",EUR,Intereses a su favor,Ing Direct,Imprevistos,Cuenta,Ingreso,Rendimientos,
1/11/21,,"-5,35",EUR,Panaderia artesana 5 sent,Ing Direct,Tarjeta Claudia,Tarjeta de crédito,Gasto,Restaurante,Autorizacion
30/10/21,,"-2,65",EUR,Madrid sur movilidad iii,Ing Direct,Tarjeta Crédito,Tarjeta de crédito,Gasto,Parking y peaje,Autorizacion
30/10/21,,"-88,75",EUR,Avda union europea,Wizink,WiZink Oro,Tarjeta de crédito,Gasto,Supermercado,
29/10/21,29/10/21,"-1.553,64",EUR,Recibo wizink bank s.a.u.,Ing Direct,Cuenta NÓMINA Principal,Cuenta,No computable,Tarjeta crédito,Pago mensual tarjeta 5267xxxxxxxx3740 liquidacion al dia : 26.10.2021
29/10/21,29/10/21,"4.000,00",EUR,Transferencia recibida de javier hernando plazas becerra nomina octubre 2021,Ing Direct,Cuenta NÓMINA Principal,Cuenta,No computable,Traspasos y transferencias,Nomina octubre 2021
29/10/21,,"-4,99",EUR,Pimkie tienda alcala,Ing Direct,Tarjeta Claudia,Tarjeta de crédito,Gasto,Ropa,Autorizacion
29/10/21,,"-13,40",EUR,Prentstore,Ing Direct,Tarjeta Claudia,Tarjeta de crédito,Gasto,Ropa,Autorizacion
29/10/21,,"-29,90",EUR,Prentstore,Ing Direct,Tarjeta Claudia,Tarjeta de crédito,Gasto,Ropa,Autorizacion
29/10/21,,"-35,00",EUR,Estacion servicio meco,Ing Direct,Tarjeta Claudia,Tarjeta de crédito,Gasto,Gasolina,Autorizacion
29/10/21,,"1.553,64",EUR,Pago recibo mes anterior,Wizink,WiZink Oro,Tarjeta de crédito,No computable,Tarjeta crédito,
29/10/21,,"-17,72",EUR,Avda union europea,Wizink,WiZink Oro,Tarjeta de crédito,Gasto,Supermercado,
28/10/21,28/10/21,"1.331,22",EUR,Nomina recibida h. principe de asturias,Ing Direct,Cuenta NÓMINA Cotitular Claudia - Compra Casa,Cuenta,Ingreso,Nómina,Paga: actual mas atrasos
28/10/21,28/10/21,"-4.000,00",EUR,Transferencia a javier hernando plazas becerra,Sabadell,CUENTA EXPANSIÓN,Cuenta,No computable,Traspasos y transferencias,748882326
28/10/21,,"-54,50",EUR,Chinata alcala de henarer,Ing Direct,Tarjeta Claudia,Tarjeta de crédito,Gasto,Ropa,Autorizacion
27/10/21,27/10/21,"-5,00",EUR,Transferencia bizum emitida,Ing Direct,Cuenta NÓMINA Principal,Cuenta,Gasto,Transferencias,Alvaro s. farewell
27/10/21,,"-14,87",EUR,Carref alcala,Wizink,WiZink Oro,Tarjeta de crédito,Gasto,Supermercado,
27/10/21,,"-19,02",EUR,Carref alcala,Wizink,WiZink Oro,Tarjeta de crédito,Gasto,Supermercado,
27/10/21,,"-9,99",EUR,Spotifyes p17ac8997f,Wizink,WiZink Oro,Tarjeta de crédito,Gasto,Servicios y productos online,
26/10/21,26/10/21,"3.781,92",EUR,"Nomina audatex datos espana, s.a.",Sabadell,CUENTA EXPANSIÓN,Cuenta,Ingreso,Nómina,022901 037100109980000 01 p eur 02320137100109980000bkbk097070009401000******8000
26/10/21,,"-5,65",EUR,L0ka84 hospital ppe astur,Ing Direct,Tarjeta Claudia,Tarjeta de crédito,Gasto,Restaurante,Autorizacion
26/10/21,26/10/21,"0,97",EUR,Transferencia ing bank nv suc en espana,Sabadell,CUENTA EXPANSIÓN,Cuenta,Ingreso,Transferencias,022901 037100323670000 01 p eur 02320137100323670000ingd097073128701000******5000
26/10/21,26/10/21,"0,90",EUR,Transferencia ing bank nv suc en espana,Sabadell,CUENTA EXPANSIÓN,Cuenta,Ingreso,Transferencias,022901 037100323670000 01 p eur 02320137100323670000ingd097073128701000******4000
26/10/21,26/10/21,"-550,00",EUR,Reintegro efectivo tarjeta bankia 2257 meco es,Ing Direct,Cuenta NÓMINA Principal,Cuenta,Gasto,Otros vivienda,Bankia 2257 meco es
26/10/21,,"-18,26",EUR,Mercadona cc alcala magna,Ing Direct,Tarjeta Claudia,Tarjeta de crédito,Gasto,Supermercado,Autorizacion
26/10/21,,"-84,07",EUR,Stradivarius,Ing Direct,Tarjeta Claudia,Tarjeta de crédito,Gasto,Ropa,Autorizacion
26/10/21,,"-16,78",EUR,Amzn mktp es*pn3se6s75,Wizink,WiZink Oro,Tarjeta de crédito,Gasto,Electrónica,
25/10/21,,"-25,99",EUR,Merkal la dehesa alcala de hen,Ing Direct,Tarjeta Claudia,Tarjeta de crédito,Gasto,Ropa,Operacion
25/10/21,,"-29,56",EUR,Avda union europea meco,Ing Direct,Tarjeta Claudia,Tarjeta de crédito,Gasto,Supermercado,Operacion
25/10/21,,"-45,99",EUR,Amzn mktp es*q12h15hr5,Wizink,WiZink Oro,Tarjeta de crédito,Gasto,Ropa,
24/10/21,,"-103,65",EUR,"Costco wholesale spain, s",Wizink,WiZink Oro,Tarjeta de crédito,Gasto,Supermercado,
24/10/21,,"-49,92",EUR,"Costco wholesale spain, s",Wizink,WiZink Oro,Tarjeta de crédito,Gasto,Gasolina,
24/10/21,,"-9,99",EUR,"Costco wholesale spain, s las rozas",Ing Direct,Tarjeta Claudia,Tarjeta de crédito,Gasto,Restaurante,Operacion
22/10/21,22/10/21,"100,00",EUR,Transferencia recibida de a.e.a.t. devoluciones tributarias aeat apl:abono antic dedu familiares-fng21mod:143inf:familia numerosa gen 09-2021 exp:2021dev14329420351p aeat,Ing Direct,Cuenta NÓMINA Principal,Cuenta,Ingreso,Devolución impuestos,Aeat apl:abono antic dedu familiares-fng21mod:143inf:familia numerosa gen 09-2021 exp:2021dev14329420351p aeat
22/10/21,22/10/21,"-105,00",EUR,Bizum fernando alcaraz martin,Sabadell,CUENTA EXPANSIÓN,Cuenta,Gasto,Regalos,9724_0016 2021-10-22 09:58:40
22/10/21,22/10/21,"10,00",EUR,Abono bizum de helene lanssens,Sabadell,CUENTA EXPANSIÓN,Cuenta,Gasto,Regalos,9724_0016 2021-10-22 08:35:45
22/10/21,22/10/21,"5,00",EUR,Abono bizum de miguel angel roldan horner,Sabadell,CUENTA EXPANSIÓN,Cuenta,Gasto,Regalos,9724_0016 2021-10-22 08:20:39
22/10/21,22/10/21,"5,00",EUR,Abono bizum de alvaro nogueira de zavala,Sabadell,CUENTA EXPANSIÓN,Cuenta,Gasto,Regalos,9724_0016 2021-10-22 08:15:03
21/10/21,21/10/21,"30,68",EUR,"Transferencia recibida de canal isabel ii, s.a. 238476419",Ing Direct,Cuenta NÓMINA Principal,Cuenta,Gasto,Agua,238476419
21/10/21,21/10/21,"10,00",EUR,Abono bizum de maria esperanza jimenez ji,Sabadell,CUENTA EXPANSIÓN,Cuenta,Gasto,Regalos,9724_0016 2021-10-21 09:54:43
21/10/21,21/10/21,"10,00",EUR,Abono bizum de fernando alcaraz martin,Sabadell,CUENTA EXPANSIÓN,Cuenta,Gasto,Regalos,9724_0016 2021-10-21 09:50:28
21/10/21,21/10/21,"10,00",EUR,Abono bizum de francisco santiago carrill,Sabadell,CUENTA EXPANSIÓN,Cuenta,Gasto,Regalos,9724_0016 2021-10-21 09:45:15
21/10/21,21/10/21,"6,00",EUR,Abono bizum de maria pilar rodriguez cres,Sabadell,CUENTA EXPANSIÓN,Cuenta,Gasto,Regalos,9724_0016 2021-10-21 09:38:16
20/10/21,20/10/21,"-22,16",EUR,Recibo vodafone,Ing Direct,Cuenta NÓMINA Principal,Cuenta,Gasto,Internet,Factura: yi21-017742413/
20/10/21,20/10/21,"-1.244,80",EUR,Recibo asteri nova s.l.,Ing Direct,Cuenta NÓMINA Principal,Cuenta,Gasto,Alquiler y compra,Recibo la gomera - octubre (n. 13)
20/10/21,20/10/21,"-962,50",EUR,Recibo asteri nova s.l.,Ing Direct,Cuenta NÓMINA Principal,Cuenta,Gasto,Alquiler y compra,Ultimo recibo mejoras - 8
20/10/21,20/10/21,"10,00",EUR,Abono bizum de juan jose lopez caballero,Sabadell,CUENTA EXPANSIÓN,Cuenta,Gasto,Regalos,9724_0016 2021-10-20 11:14:53
19/10/21,18/10/21,"10,00",EUR,Abono bizum de david de la horra iglesias,Sabadell,CUENTA EXPANSIÓN,Cuenta,Gasto,Regalos,9724_0016 2021-10-18 19:41:19
19/10/21,19/10/21,"-125,00",EUR,Transferencia emitida periódica,Ing Direct,Cuenta NÓMINA Principal,Cuenta,No computable,Traspasos y transferencias,Transferencia universidad
19/10/21,19/10/21,"5,00",EUR,Abono bizum de tai ge chen,Sabadell,CUENTA EXPANSIÓN,Cuenta,Gasto,Regalos,9724_0016 2021-10-19 15:52:43
19/10/21,,"-39,99",EUR,Marypaz,Ing Direct,Tarjeta Claudia,Tarjeta de crédito,Gasto,Ropa,Autorizacion
19/10/21,,"-35,00",EUR,Estacion servicio meco,Ing Direct,Tarjeta Claudia,Tarjeta de crédito,Gasto,Gasolina,Autorizacion
19/10/21,19/10/21,"125,00",EUR,Tran.ot.entidade - tran.ot.entidade,ImaginBank,Antes cta .....2594,Cuenta,Ingreso,Transferencias,6raj9f435lhbi
18/10/21,18/10/21,"-70,95",EUR,"Recibo endesa energia, s.a.",Ing Direct,Cuenta NÓMINA Principal,Cuenta,Gasto,Electricidad,Factura de electricidad pm9109n0046554 contrato 012162261633 de endesa energia sau
18/10/21,18/10/21,"10,00",EUR,Abono bizum de alberto valdivia garcia,Sabadell,CUENTA EXPANSIÓN,Cuenta,Gasto,Regalos,9724_0016 2021-10-18 13:31:25
18/10/21,18/10/21,"5,00",EUR,Abono bizum de francisco jose cuesta sanc,Sabadell,CUENTA EXPANSIÓN,Cuenta,Gasto,Regalos,9724_0016 2021-10-18 12:10:13
18/10/21,18/10/21,"10,00",EUR,Abono bizum de fernando gea velez,Sabadell,CUENTA EXPANSIÓN,Cuenta,Gasto,Regalos,9724_0016 2021-10-18 11:33:59
18/10/21,,"-7,00",EUR,Dehesa regalos,Ing Direct,Tarjeta Claudia,Tarjeta de crédito,Gasto,Regalos,Autorizacion
18/10/21,,"-20,00",EUR,Avda union europea,Ing Direct,Tarjeta Claudia,Tarjeta de crédito,Gasto,Supermercado,Autorizacion
18/10/21,,"-5,55",EUR,Grupo ahorramas 1371,Ing Direct,Tarjeta Claudia,Tarjeta de crédito,Gasto,Supermercado,Autorizacion
18/10/21,,"-72,33",EUR,Estacion servicio meco,Wizink,WiZink Oro,Tarjeta de crédito,Gasto,Gasolina,
18/10/21,,"-0,10",EUR,Comisión por cambio de divisa,Wizink,WiZink Oro,Tarjeta de crédito,Gasto,Regalos,
18/10/21,,"-5,17",EUR,Kudoboard,Wizink,WiZink Oro,Tarjeta de crédito,Gasto,Regalos,
17/10/21,,"-55,00",EUR,Annightingale shop,Wizink,WiZink Oro,Tarjeta de crédito,Gasto,Librería,
17/10/21,,"-130,00",EUR,Cuota servicio compra facil,Wizink,WiZink Oro,Tarjeta de crédito,Gasto,Hotel,
16/10/21,,"-102,00",EUR,Avda union europea,Wizink,WiZink Oro,Tarjeta de crédito,Gasto,Supermercado,
14/10/21,14/10/21,"-25,13",EUR,Recibo vodafone,Ing Direct,Cuenta NÓMINA Principal,Cuenta,Gasto,Internet,Factura: yi21-017095020/
14/10/21,,"-26,56",EUR,Avda union europea,Ing Direct,Tarjeta Claudia,Tarjeta de crédito,Gasto,Supermercado,Autorizacion
13/10/21,13/10/21,"20,00",EUR,Abono bizum de irene mendoza tortosa,Sabadell,CUENTA EXPANSIÓN,Cuenta,Gasto,Loterías,9724_0016 2021-10-13 18:28:40
13/10/21,13/10/21,"20,00",EUR,Abono bizum de beatriz vega navas,Sabadell,CUENTA EXPANSIÓN,Cuenta,Gasto,Loterías,9724_0016 2021-10-13 17:39:31
13/10/21,,"-7,24",EUR,Carref alcala,Ing Direct,Tarjeta Claudia,Tarjeta de crédito,Gasto,Supermercado,Autorizacion
13/10/21,,"-60,00",EUR,La cervantina admon 4,Ing Direct,Tarjeta Claudia,Tarjeta de crédito,Gasto,Loterías,Autorizacion
11/10/21,9/10/21,"-2,00",EUR,Bizum juan carrascosa tejedor,Sabadell,CUENTA EXPANSIÓN,Cuenta,Gasto,Otros gastos,9724_0016 2021-10-09 20:28:30
11/10/21,11/10/21,"-242,87",EUR,"Recibo volkswagen bank, gmbh s.e.",Ing Direct,Cuenta NÓMINA Principal,Cuenta,Gasto,Compra vehículo,"Vcto. 09/10/2021, contrato: 01fi50031252,atencion cliente volkswagen bank : 914279900,el pago de este recibo no implica pagos anteriores."
11/10/21,,"-4,99",EUR,Hpi instant ink spain,Ing Direct,Tarjeta Crédito,Tarjeta de crédito,Gasto,Servicios y productos online,Autorizacion
11/10/21,11/10/21,"-48,00",EUR,Bizum maria julia di benedetto,Sabadell,CUENTA EXPANSIÓN,Cuenta,Gasto,Estudios,9724_0016 2021-10-11 12:14:00
9/10/21,9/10/21,"6.000,32",EUR,Traspaso interno recibido,Ing Direct,Cuenta NARANJA,Cuenta,No computable,Traspasos y transferencias,Cuenta naranja
9/10/21,9/10/21,"20.718,51",EUR,Traspaso recibido cuenta nómina,Ing Direct,Cuenta NARANJA,Cuenta,No computable,Traspasos y transferencias,Cuenta naranja
9/10/21,9/10/21,"-20.718,51",EUR,Traspaso emitido cuenta nómina,Ing Direct,Cuenta NÓMINA Cotitular Claudia - Compra Casa,Cuenta,No computable,Traspasos y transferencias,Cuenta naranja
9/10/21,9/10/21,"-6.000,32",EUR,Traspaso interno emitido,Ing Direct,Imprevistos,Cuenta,No computable,Traspasos y transferencias,Cuenta naranja
9/10/21,,"-74,77",EUR,Avda union europea,Ing Direct,Tarjeta Crédito,Tarjeta de crédito,Gasto,Supermercado,Autorizacion
9/10/21,,"-11,93",EUR,Paypal *promofarma,Wizink,WiZink Oro,Tarjeta de crédito,Gasto,Farmacia,
8/10/21,,"-7,99",EUR,Sfera m alcala magna,Ing Direct,Tarjeta Claudia,Tarjeta de crédito,Gasto,Ropa,Autorizacion
7/10/21,7/10/21,"-20,00",EUR,Bizum juan ramon del amo lopez,Sabadell,CUENTA EXPANSIÓN,Cuenta,Gasto,Regalos,9724_0016 2021-10-07 13:48:08
7/10/21,,"-12,00",EUR,Aparcamiento juan bravo,Ing Direct,Tarjeta Crédito,Tarjeta de crédito,Gasto,Parking y peaje,Autorizacion
6/10/21,5/10/21,"6,50",EUR,Abono bizum de maria del pilar marquez mo,Sabadell,CUENTA EXPANSIÓN,Cuenta,Gasto,Supermercado,9724_0016 2021-10-05 21:44:51
6/10/21,5/10/21,"60,15",EUR,Abono bizum de ana julissa sandoval amore,Sabadell,CUENTA EXPANSIÓN,Cuenta,Gasto,Supermercado,9724_0016 2021-10-05 20:55:24
6/10/21,5/10/21,"97,93",EUR,Abono bizum de patricia daniela pasquier,Sabadell,CUENTA EXPANSIÓN,Cuenta,Gasto,Supermercado,9724_0016 2021-10-05 20:53:39
6/10/21,6/10/21,"-400,00",EUR,Traspaso periódico emitido nómina,Ing Direct,Cuenta NÓMINA Principal,Cuenta,No computable,Traspasos y transferencias,Spo to 2700287602
6/10/21,6/10/21,"400,00",EUR,Traspaso periódico recibido,Ing Direct,Imprevistos,Cuenta,No computable,Traspasos y transferencias,Spo from 1708097649
6/10/21,,"-1,25",EUR,Fcia. garcia alonso,Ing Direct,Tarjeta Claudia,Tarjeta de crédito,Gasto,Farmacia,Autorizacion
6/10/21,,"-2,15",EUR,Grupo ahorramas 1371,Ing Direct,Tarjeta Claudia,Tarjeta de crédito,Gasto,Supermercado,Autorizacion
5/10/21,5/10/21,"-350,00",EUR,Recibo fundacion colegio alborada,Ing Direct,Cuenta NÓMINA Principal,Cuenta,Gasto,Estudios,Cobro procedente de la factura 69256
5/10/21,5/10/21,"-693,92",EUR,Cargo mensual tarjeta crédito,Ing Direct,Cuenta NÓMINA Principal,Cuenta,No computable,Tarjeta crédito,Liq. tarjeta crédito : 0160001
5/10/21,,"-63,57",EUR,Costco gasolinera getafe,Ing Direct,Tarjeta Crédito,Tarjeta de crédito,Gasto,Gasolina,Autorizacion
5/10/21,,"-314,98",EUR,Costco wholesale spain s,Ing Direct,Tarjeta Claudia,Tarjeta de crédito,Gasto,Supermercado,Autorizacion
5/10/21,,"-220,41",EUR,Talleres busmacar,Ing Direct,Tarjeta Claudia,Tarjeta de crédito,Gasto,Mantenimiento vehículo,Autorizacion
5/10/21,,"-17,98",EUR,"Costco wholesale spain, s",Wizink,WiZink Oro,Tarjeta de crédito,Gasto,Supermercado,
5/10/21,,"-7,18",EUR,"Costco wholesale spain, s",Wizink,WiZink Oro,Tarjeta de crédito,Gasto,Restaurante,
5/10/21,,"-1,90",EUR,Atpseitt meco->m-50n,Wizink,WiZink Oro,Tarjeta de crédito,Gasto,Parking y peaje,
5/10/21,,"-1,00",EUR,Atpseitt alcala->meco,Wizink,WiZink Oro,Tarjeta de crédito,Gasto,Parking y peaje,
5/10/21,,"-0,60",EUR,Atpseitt alcobenda->alco,Wizink,WiZink Oro,Tarjeta de crédito,Gasto,Parking y peaje,
5/10/21,5/10/21,"-127,28",EUR,Universidad de al - universidad de al,ImaginBank,Antes cta .....2594,Cuenta,Gasto,Estudios,Q2818018j
4/10/21,4/10/21,"-34,33",EUR,"Recibo banco cooperativo espanol, s.a.",Ing Direct,Cuenta NÓMINA Principal,Cuenta,Gasto,Óptica y dentista,Recibo de pr stamo 2038754855 periodo: 01-09-2021 al 01-10-2021.para mayor informaci n consulte a la entidad emisora del recibo.
4/10/21,4/10/21,"-5.000,00",EUR,Traspaso interno emitido,Ing Direct,Cuenta NÓMINA Cotitular Claudia - Compra Casa,Cuenta,No computable,Traspasos y transferencias,Pagos casa
4/10/21,4/10/21,"653,74",EUR,Transferencia recibida de aerovias del continente americano sa avianca sucursal en espana,Ing Direct,Cuenta NÓMINA Principal,Cuenta,Gasto,Transportes,
4/10/21,4/10/21,"5.000,00",EUR,Traspaso interno recibido,Ing Direct,Cuenta NÓMINA Principal,Cuenta,No computable,Traspasos y transferencias,Pagos casa
4/10/21,4/10/21,"-25,00",EUR,Transferencia emitida a sandra martin natalia octubre,Ing Direct,Cuenta NÓMINA Principal,Cuenta,Gasto,Deporte,Natalia octubre
4/10/21,,"-9,10",EUR,Avda union europea,Ing Direct,Tarjeta Claudia,Tarjeta de crédito,Gasto,Supermercado,Autorizacion
4/10/21,,"-29,95",EUR,Fcia. garcia alonso,Ing Direct,Tarjeta Claudia,Tarjeta de crédito,Gasto,Farmacia,Autorizacion
4/10/21,,"-59,99",EUR,Cortefiel,Ing Direct,Tarjeta Claudia,Tarjeta de crédito,Gasto,Ropa,Autorizacion
4/10/21,,"-29,99",EUR,Cortefiel,Ing Direct,Tarjeta Claudia,Tarjeta de crédito,Gasto,Ropa,Autorizacion
4/10/21,,"-51,62",EUR,Panaderia artesana 5 sent,Wizink,WiZink Oro,Tarjeta de crédito,Gasto,Regalos,
4/10/21,,"-16,00",EUR,Renfe cercanias tna 28 1,Wizink,WiZink Oro,Tarjeta de crédito,Gasto,Transportes,
3/10/21,3/10/21,"-136,44",EUR,Cargo cuota de préstamo,Ing Direct,Cuenta NÓMINA Principal,Cuenta,Gasto,Préstamos,Cargo cuota préstamo 7715027306/15
3/10/21,3/10/21,"-90,23",EUR,Cargo cuota de préstamo,Ing Direct,Cuenta NÓMINA Principal,Cuenta,Gasto,Préstamos,Cargo cuota préstamo 7712284698/29
3/10/21,,"-46,51",EUR,Estacion servicio meco,Wizink,WiZink Oro,Tarjeta de crédito,Gasto,Gasolina,
3/10/21,,"-222,31",EUR,American0012302555080,Wizink,WiZink Oro,Tarjeta de crédito,Gasto,Transportes,
2/10/21,,"-177,00",EUR,La fogata,Wizink,WiZink Oro,Tarjeta de crédito,Gasto,Restaurante,
2/10/21,,"-109,63",EUR,Avda union europea,Wizink,WiZink Oro,Tarjeta de crédito,Gasto,Supermercado,
1/10/21,1/10/21,"-26,25",EUR,Seguros adeslas madrid,Sabadell,CUENTA EXPANSIÓN,Cuenta,Gasto,Seguro salud,022901 037071749740000 01 p eur 02320137071749740000caix0573931153010000078880000
1/10/21,1/10/21,"-10,00",EUR,Adeudo recibo parroquia ntra. sra. del transito,Sabadell,CUENTA EXPANSIÓN,Cuenta,Gasto,Solidaridad,022901 037071212340000 01 p eur 02320137071212340000bsch0576517228010000049810000
1/10/21,1/10/21,"0,03",EUR,Intereses a su favor,Ing Direct,Cuenta NARANJA,Cuenta,Ingreso,Rendimientos,
1/10/21,1/10/21,"0,01",EUR,Abono promoción cta. impuestos cero,Ing Direct,Imprevistos,Cuenta,Ingreso,Devolución impuestos,Abono promoción devolución hacienda
1/10/21,1/10/21,"0,04",EUR,Intereses a su favor,Ing Direct,Imprevistos,Cuenta,Ingreso,Rendimientos,
1/10/21,1/10/21,"-77,89",EUR,Recibo servicios financieros carrefour efc sa,Ing Direct,Cuenta NÓMINA Principal,Cuenta,Gasto,Electrónica,Financie-octubre
1/10/21,1/10/21,"-9,24",EUR,Recibo telefonica moviles espana,Ing Direct,Cuenta NÓMINA Principal,Cuenta,Gasto,Móvil,Factura tuenti
1/10/21,1/10/21,"-6,15",EUR,Recibo telefonica moviles espana,Ing Direct,Cuenta NÓMINA Principal,Cuenta,Gasto,Móvil,Factura tuenti
1/10/21,1/10/21,"-7,15",EUR,Recibo telefonica moviles espana,Ing Direct,Cuenta NÓMINA Principal,Cuenta,Gasto,Móvil,Factura tuenti
1/10/21,1/10/21,"-13,24",EUR,Recibo metlife europe designated activitycompany,Ing Direct,Cuenta NÓMINA Principal,Cuenta,Gasto,Seguro vida,0020217276577209450p:2203014569 p.net 12.20 con 0.04 clea 0.02 ips 0.98 mes vto 011021 politica privacidad www.metlife.es 900201040
30/09/21,30/09/21,"-548,02",EUR,Prestamos adeudo cuota n.8072699409 30/09/21,Sabadell,CUENTA EXPANSIÓN,Cuenta,Gasto,Hipoteca,002001eur2021-09-30-00.08.24.760003 0020000103333083301dv ø
30/09/21,30/09/21,"1.405,73",EUR,Nomina recibida h. principe de asturias,Ing Direct,Cuenta NÓMINA Cotitular Claudia - Compra Casa,Cuenta,Ingreso,Nómina,Paga: actual mas atrasos
30/09/21,30/09/21,"-1.003,60",EUR,Recibo wizink bank s.a.u.,Ing Direct,Cuenta NÓMINA Principal,Cuenta,No computable,Tarjeta crédito,Pago mensual tarjeta 5267xxxxxxxx3740 liquidacion al dia : 27.09.2021
30/09/21,30/09/21,"9.134,54",EUR,Transferencia recibida,Ing Direct,Cuenta NÓMINA Cotitular Claudia - Compra Casa,Cuenta,Ingreso,Transferencias,Resto venta vivienda c/estonia-meco
30/09/21,30/09/21,"-153.448,01",EUR,Prestamos amortización anticipada n.8072699409,Sabadell,CUENTA EXPANSIÓN,Cuenta,No computable,Traspasos y transferencias,0001034122010 pago hipoteca
30/09/21,30/09/21,"153.448,01",EUR,Transferencia target2 de ramos alvarez miguel angel,Sabadell,CUENTA EXPANSIÓN,Cuenta,No computable,Traspasos y transferencias,091269105044092 venta piso
30/09/21,30/09/21,"50,00",EUR,Abono bizum de isaac luque baltasar,Sabadell,CUENTA EXPANSIÓN,Cuenta,Ingreso,Transferencias,9724_0016 2021-09-30 18:32:44
30/09/21,30/09/21,"-20,00",EUR,Ingreso fondos-planes,Ing Direct,Cuenta NÓMINA Principal,Cuenta,No computable,Inversiones,Aportaciones al plan: 4103616046-15-14
30/09/21,,"-25,99",EUR,Dismoda com distrib,Ing Direct,Tarjeta Claudia,Tarjeta de crédito,Gasto,Ropa,Autorizacion
30/09/21,,"1.003,60",EUR,Pago recibo mes anterior,Wizink,WiZink Oro,Tarjeta de crédito,No computable,Tarjeta crédito,
29/09/21,28/09/21,"-4,00",EUR,Bizum miguel angel sanchez ruiz,Sabadell,CUENTA EXPANSIÓN,Cuenta,Gasto,Transferencias,9724_0016 2021-09-28 21:28:22
29/09/21,29/09/21,"100,00",EUR,Transferencia recibida de a.e.a.t. devoluciones tributarias aeat apl:abono antic dedu familiares-fng21mod:143inf:familia numerosa gen 08-2021 exp:2021dev14329420311d aeat,Ing Direct,Cuenta NÓMINA Principal,Cuenta,Ingreso,Devolución impuestos,Aeat apl:abono antic dedu familiares-fng21mod:143inf:familia numerosa gen 08-2021 exp:2021dev14329420311d aeat
29/09/21,,"-30,00",EUR,Estacion servicio meco,Wizink,WiZink Oro,Tarjeta de crédito,Gasto,Gasolina,
28/09/21,,"-36,39",EUR,Avda union europea,Wizink,WiZink Oro,Tarjeta de crédito,Gasto,Supermercado,
27/09/21,27/09/21,"-68,98",EUR,Recibo vodafone,Ing Direct,Cuenta NÓMINA Principal,Cuenta,Gasto,Internet,Factura: yi21-016260306/
27/09/21,,"-11,95",EUR,Fcia heras ballestero,Ing Direct,Tarjeta Claudia,Tarjeta de crédito,Gasto,Farmacia,Autorizacion
27/09/21,,"-49,90",EUR,Zara alcala cc.alc.magna,Ing Direct,Tarjeta Claudia,Tarjeta de crédito,Gasto,Ropa,Autorizacion
27/09/21,,"-4,99",EUR,Spotifyes p172a87769,Wizink,WiZink Oro,Tarjeta de crédito,Gasto,Servicios y productos online,
